Item# (SKU),Item Name,Catalog Page,Imprint Area,Product Description,Price Includes,Imprint Method 1,Imprint Method 2,Shipping Weight (lbs),Shipping Quantity,Shipping Dimensions (inch),Packaging,Additional Info,Pricing-Qty1,Pricing-Qty2,Pricing-Qty3,Pricing-Qty4,Pricing-Qty5,Pricing-Price1,Pricing-Price2,Pricing-Price3,Pricing-Price4,Pricing-Price5,Pricing-Code1,Pricing-Code2,Pricing-Code3,Pricing-Code4,Pricing-Code5,Available Colors,Product Categories,Related Products,Search KeywordsJAVAMUG,Java Stripe Mug,61,"1-1/2""h x 2""w each side or 1-1/2""h x 7-1/2""w wrap","12oz. white ceramic mug with color stripe on  C"" handle.    Individually polybagged.    Egg crate packaging.",One color imprint.,Silkscreen,,31,36,14L x 11W x 16H,Individually polybagged.,Must add  6.25 G  per case of 36 for damage-resistant boxes. All partial case quantities will be automatically rounded to the nearest case amount without notification.,144,288,576,1152,2304,3.19,3.05,2.89,2.75,2.59,C,C,C,C,C,"RED, BLACK, LIME, BLUE, PURPLE",Drinkware,"SSLENDSP, 12GRPNGO, 16GRPNGO, 12ORBTMB, 15ORBTMG, 11CAFEMG, 11CAFECR, 20FRSTBB, 20TINTBB, 24AERIAL, BIKEBTLC, ORBTRNL, 16JAMOCA, 12BISTRO, TOGOTMB, 14PATTMB, 14ECONMG, 17OUTBK, 24REVNEO, 24REVOTL, SLENDSIP, CARYTMB, LAZERBTL, SPRACLMC, MULTTASK, TAGGEL, H","ceramic mug, java, c handle"JAVAMUG_CL,Java Stripe Mug - Closeout,,"1-1/2""h x 2""w each side or 1-1/2""h x 7-1/2""w wrap","12oz. white ceramic mug with color stripe on  C"" handle.    Individually polybagged.    Egg crate packaging.",One color imprint.,Silkscreen,,,,,Individually polybagged.,Must add  6.25 G  per case of 36 for damage-resistant boxes. All partial case quantities will be automatically rounded to the nearest case amount without notification.,,,,,,,,,,,,,,,,White/Orange,Drinkware,"12BISTRO, 11CAFEMG, 11CAFECR, 16VOY_CL, TERRNBK_CL, SONICKL_CL, TRVSETBG_CL, 22IM_CL, LETHSTPK_CL, SILNTHI_CL, YORKPEN, GSRVTQSR, SUMITPEN, FORCSTUM, CTYSLKNB, CRKNTBK, FACILTP, TIRGEKYC, TRICRKSW_CL, SLIDMAG, CSTCK, STPLRMV, GELEHIGH, REWNDHL, COZYCASE_C",JETBKSK,Jetty Backsack,181,"6""h x 6""w","210D polyester with one side mesh pocket.    Contrasting color scheme.    Drawstring construction.    Actual size is 16-1/2""h x 13""w.",One color imprint.,Silkscreen,,20,200,19L x 17W x 12H,,,150,250,500,1000,2500,3.29,3.15,2.99,2.85,2.49,C,C,C,C,C,"LIME, NAVY, RED, GREY, ORANGE, MAROON, BLUE, YELLOW, BLACK, HUNTER GREEN, PURPLE",Bags,"CLRNBKSK, METPBKSK, 16FREFAC, 16FREONE, BSKTBL, TIDYUPKC, VALETKR, THMGOB25, THMGOBTL, 25QUEST_CL, SPECSBTL, STRAWCQ_CL, YOGCLKT, PLANEWLM_CL, EVERYSHP_CL, XXLRECGY_CL, VISTSLNG, WILSNGLS, UNIUSB, YOGABLK, NMDTRAD, TECHMSE_CL, PLAPKLAM_CL, SHOPTOTE_CL, EX","springforward, sports, school, gym, drawstring, colorsurge, camping, polyester, pocket, mesh, backsack, gymbag, beach, bags, tangerinetango, tote"JIVEHDPH,Jive Bluetooth Headphones,,"1-1/2""d","Bluetooth Headphones with FM Radio,USB charging cable.    Transmission range up to 30 feet.    Charging cables included",One color imprint on both sides.,Silkscreen,,38,60,21L x 15W x 26H,Individually boxed.,,10,20,40,80,100,47.99,46.99,43.99,41.59,39.99,C,C,C,C,C,BLACK,Techno Trends,"CLAMFXLT, DIAMTMB, DESMBPCK, TOGOTMB, TROOPTMB, MANHATTB, TURNTMB, NTROBKSK, FLEXFOLD_CL, TWNTBCHG, RETROHS, LED17FLH, ULPOWBK, MINWNDFL, RULRCLSI, RETRFLSH, FLSHSTK, NOVLEDFL, PHZRFLSH, 27FLPFRE, FLIPBNDG, LPMEDPCH, CLRFILE, CLRFILE_CL, CLRBRITE_CL, SICW","summer2014, marchitems"JUBCLTOT,Jubilee Cooler Tote,207,"5""h x 7-1/2""w",Lunch time 210D polyester heat sealed insulated cooler tote for more than just a sandwich.     Large front pocket and zippered top.     Wide bottom allows for food containers to be stored in upright position helping to prevent spills.     Many size water ,One color imprint.,Silkscreen,,15,50,22L x 16W x 14H,,Freezer gel packs recommended for cooling.,50,100,250,500,1000,6.99,6.69,6.29,5.99,5.69,C,C,C,C,C,"Aqua, Lime, Pink, Royal",Coolers,"BOMBTSK, CALLCASH, BNDYBRT, TECCHGST, TRIBSPK, UNIUSB, ORBINF, RIVIBAG, FTNSDUFL, WEBTOTE, COLKONE, SPRINTSS, 18FLPFRE, UNOCUP, TRSTAMBG, RBSUNGLS, MANSALON, CAPRSTPN, BABELIPN, CARNVPN, VIVIDPN, GRVGLWLT, OASISBTL, NIKISTPN, METPBKSK, MEALTOGO, MUTRDVTL,",JUMBOHI_CL,Jumbo Highlighter - Closeout,,"1-1/2""h x 1-3/4""w",Large imprint area.    Yellow highlighter.    Individually polybagged.,One color imprint.,Silkscreen,,,,,Individually polybagged.,This item requires a 2 day production time for imprinting.  There is no set up charge on exact re-orders for writing instruments.,,,,,,,,,,,,,,,,YELLOW,Writing Instruments,"TREMEBRT_CL, HANLOTON, NOLAPN_CL, SWAMPJUI, MANSALON, FUSEBOX, MARKITUP_CL, PANAPN_CL, MARCOPN_CL, SILNTHI_CL, SKEPNHI_CL, EDISON_CL, CLAYPN_CL, EXECNTFL_CL, ECOCLK_CL, GEMHIPNS_CL, GEMHIPEN_CL, MASTRTL, MEDLNUSB, SPSTKPD, STANRMVR, SPECTRA, DENALIPN, EXE",JUPITPN,Jupiter Pen,78,"1/2""h 1-1/2""w","Plastic barrel ball point pen with rubber grip.     Actual size 5-3/4"".     Retractable mechanism.     Pearl metallic finish.",One color print.,Silkscreen,,,,,,There is no set up charge on exact re-orders for writing instruments.,500,5000,,,,0.75,0.75,,,,C,C,,,,"Orange, Green, Purple, Blue",Writing Instruments,"11CAFEMG, 16CORTMB, 16ORBTMB, DRAWBKSK, DRAWSPRT, HANSPRAY, MAGNAJMB, MEDILNGS, MEDIASTA, RIVET, UNOCUP, 14PATTMB, HLTHHND, LIPBALM, MANSALON, SUNSPYLB, SWAMPJUI, TEKTRACK, TEMPRPCK, TRIBSPK, ULADPTR, UNIUSB, WILSNGLS, BIGISTPN, CAPRSTPN, SAVVYPN, 30POLYC",K2USBFAN,K2 USB Fan,172,"1-3/8"" diameter","Mini fan with USB connector.    360 degree rotatable blades.    Perfect desk size.    Actual size is 5-7/8""h x 5-7/8""w.    Packaged in white box.",One color imprint.,Silkscreen,,17,30,20L x 21W x 13H,Packaged in white box.,,60,120,240,480,960,6.99,6.79,6.49,6.19,5.99,C,C,C,C,C,WHITE,Workplace,"BELLATMB, 34BUBTVL, BUBKEG, SSLENDSP, CHIAMNTY_CL, TRICRKSW_CL, SLMPKTL_CL, SODATRIT, BUSCLGTG, RENPENC, CANOODPN, PIGGYBNK, VIVIDPN, 22FREDOM_CL, PNPDSGNB, TETHGEL, YORKPEN, HLTHHND, TRVSETBG_CL, SAVYHND, NORDGRIP, GLFPKATH, CRWNGRPT_CL, RBSUNGLS, VELOST",summerKCMSHBK,KC Mesh Backsack,182,"4""h x 6""w","Mesh drawstring construction backsack with matching cords.    210D front pocket with hook and loop closure.    Allows wet items to dry.    Can hold up to 7 lbs.    Actual size is 16-1/2""h x 17-3/4""w x 8-1/2"" gusset.",One color imprint.,Silkscreen,,,,,,,150,250,500,1000,2500,3.35,3.19,3.05,2.89,2.79,C,C,C,C,C,"BLUE, ORANGE, BLACK, RED, LIME",Bags,"TIDYUPKC, GSHOPKATH, CONCORD, RETRFLSH, PAPRPENC, MTYBRITE, RIVET, CFLYER, STDCUP20, BIOCUP, LCURVEX, VIVDCMBO, VELOSTPN, UNDPRKLT, UNOMUG, UNIUSB, WTRTBPCH, CHROM6PK, FLOATER, 20FLATFL, NEOFLAT, LAZERBTL, LTDFLTBL, SHAKITUP, ACTSPBTL, BRANDCHG, SUNSHDE, ","mesh, pocket, sports, tangerinetango, school, beach, tote, bags, gymbag, gym, camping, colorsurge, backsack, drawstring"KICKSTND,Kickstand,116,"2""h x 2""w","Small enough to put in back pocket but big enough to hold tablets, phones, MP3, or other media devices.    Features two skid proof strips on the bottom to keep item in place during use.    Actual size is 3""h x 2-3/4""w.    Individually polybagged.",One color imprint.,Silkscreen,,31,500,15L x 18W x 7H,Individually polybagged.,One day production time from art approval.,250,500,1000,1500,2500,1.39,1.29,1.19,1.09,0.99,C,C,C,C,C,"BLACK, BLUE, WHITE, RED",Techno Trends,"TCHKYCN, RIVIBAG, RUBMSPD, RENPENC, GESSENBG, WIDEMES, SAVVYPN, SOLARPN, MEMOCUBE, GOLFBALL, TTLPROV1, TRVLBLKT, STANRMVR, GFBXTMB, QUADCANV, CATLINEX, CERENJR, CAMOKLR, HANDSAN, VIBRNTLP, EXECBAND, K2USBFAN, MP3MINI, USBCOLTK, USBFOLD, HNDWARM, SWAMPJUI,",KLCSTK,Klicker Stick Pen,84,"3/4""h x 1-3/8""w",Solid white barrels.    Retractable mechanism.    Medium point black refill.,One color imprint.,Silkscreen,,7,425,12L x 13W x 7H,,There is no set up charge on exact re-orders for writing instruments.,500,750,1000,2500,5000,0.4,0.39,0.37,0.36,0.35,C,C,C,C,C,"TURQUOISE, BLUE, GREEN, BLACK, RED, MAROON, NAVY, ORANGE, PURPLE",Writing Instruments,"GRPGRAN, 16GRPNGO, CITYLNH, KICKSTND, RETROHS, MULMDKPR, NOVLEDFL, STPLRMV, MULMDATH, SLIDACLP, SAVYHND, HABTSHP, SPRFNBTL, MINIWIPE, SILVCMBO, HSEKYHLD, NEOCLONE, METROBK, MINICHI, HOWDYTZR, LTDFLTBL, MESURCUP, SHAKITUP, STADBLKT, ITABSLV, MICRCLTH, IWEA","retractable, solid, tangerinetango, transparent"KLICKPN_CL,Klick Klick Pen - Closeout,,"3/4""h x 1-1/2""w",Click pen with side release.    Medium point black refill.,One color imprint.,Silkscreen,,,,,,There is no set up charge on exact re-orders for writing instruments.,,,,,,,,,,,,,,,,"TRANS GREEN, TRANS RED, TRANS BLUE, TRANS ORANGE, TRANS PURPLE",Writing Instruments,"CABANAPN_CL, MANI2GO_CL, SPHRLTOP_CL, FXHEADPH, PROPITUP, FLOS2GO_CL, HIFIVHI_CL, TEMPOPNW_CL, CAPTVAPN_CL, TEMPOPN_CL, LAPTPSLV_CL, HEARTRE, GLOBE, STRSBL, RIBBON_CL, STAR, CEOPEN_CL, CUBELEDK_CL, GEMINPNS_CL, INTOUCH, VIBRNTLP, SPRTYWAV_CL, LGTNLOOK, UN",KLPNOTES,KlipNotes,166,"3/16""h x 5-1/2""w","Transparent and solid colors.    Easily adheres to computer monitor, refrigerators, lockers, dashboards and more.    No residue when removed!    Creative support for holding documents, notes, and photos.    Computer users can type while KlipNotes  holds t",One color imprint.,Silkscreen,,,,,,"1. KlipNotes  is a registered trademark of Affixit, LLC and is covered by US Patent D601,629S.  2. Dark imprints on the Clear KlipNotes  do not show up well once applied to a dark surface.  3. Instruction cards sent with samples only.",250,500,1000,2500,5000,1.19,1.09,0.99,0.89,0.79,C,C,C,C,C,"WHITE, PURPLE, LIME, ORANGE, CLEAR, BLUE, RED, SMOKE",Workplace,"BBUY, CACHEPN, VIVDCMBO, GSHOPKATH, SUNSCRGK, PAPRPENC, 24AERIAL, CFLYER, UNDPRKLT, UNOMUG, UNIUSB, CHROM6PK, CHRODLUX, TRVBKPK, HATCHBAG, SUNSHDSQ, FLSHSTK, DBLVISN, WHSKLT, TECCHGST, UNOLED, MINWNDFL, VWINOPN, SICWINBG, IRWINEXE, RLCPCLBG, RIVIBAG, CHRO","tangerinetango, deskmess, clip"KPCLGKT,Keep It Cool Golf Kit,232,"Keep It Cool Towel  storage tube only : 1-1/2""h x 6""w  Golf Balls: 7/8"" diameter  Golf Tees: 7/16""h x 1-3/8""w","Kit includes two Authoritee  golf balls, Keep It Cool Towel and five 2-3/4 Golf Tees.    Keep It Cool Towel also available separately as  KPCLTWL.","One color imprint on each item in the pack, 1-4 color imprint on one pole of the golf balls.",Silkscreen,,28,50,17L x 26W x 13H,,1. Keep towel stored in container when not in use.  2. Free spec sample product exceptions include all of the above stated in EQP exceptions. Spec sample decoration exemptions include Color Surge and dome items. Freight not included.,50,100,200,500,1000,12.99,12.59,11.99,11.49,10.99,C,C,C,C,C,,Lifestyles,"BASEBL, BSKTBL, ARROW, APPLE, CARATIZE, CLPCPHAN, 16CORCLR, DENALIPN, 34BUBTVL, ELLSWORT, BEVRCDCM, SMOOTHMV, SUNTOT, SIPNSTYL, SUNLOTON, STCHSWKT, SOLARPN, SPRACLMC, SPECSBTL, SUNSTCK, SHOTABST, SAVVYPN, RLCPCLBG, RDTRPPR, RETRVKL, PNKYHY, RTRMDLNG, POWB",golfkit14KPCLTWL,Keep It Cool Towel,226,"1-1/2""h x 6""w  container only","New colors added!    Cooling towel retains water while remaining  dry to touch.    PVA material keeps you cool up to 4 hours.    Actual size - Towel size 26""w x 17""h.    Container size is 10""h x 3""d. Strap is 3-1/2"".    Instruction card included.",One color imprint.,Silkscreen,,37,100,21L x 26W x 16H,,Keep towel stored in container when not in use.,100,250,500,1000,2500,8.19,7.89,7.29,6.89,6.59,C,C,C,C,C,"BLUE, GREY, ORANGE, YELLOW",Lifestyles,"SILBRACP, MAGNAJMB, CLIPRND, ESQPEN, COVCLBD, MAGNACLP, SNGLSCPM, CLPSAFLS, PENCIL, GLOBE, RIBBON, STRSBL, STAR, FOOTBL3, CAMOKLR, SLICKCLR, TETHGEL, 20STD2GO, RUBMSPD, BUBKEG, 16SATMUG, 16GRPNGO, 18FLPFRE, 16CORMUG, JAVAMUG, BABBUBKG, 16JAMOCA, SHOEKT, S","cool towel, fitness2015"LAPTPSLV_CL,Laptop Sleeve - Closeout,,"Option 1: 6-1/2""h x 8-1/2""w   Option 2: 8-1/2""h x 6-1/2""w","Flexible neoprene laptop sleeve cushions and protects laptop computers. Holds laptops 15"" or smaller. Actual size is 14-1/8""h x 11-3/4""w.",One color imprint.,Silkscreen,,,,,,Option  1 is standard imprint.,50,,,,,4.98,,,,,C,,,,,"BLACK, BLUE",Techno Trends,"CABANAPN_CL, MANI2GO_CL, SPHRLTOP_CL, FXHEADPH, PROPITUP, FLOS2GO_CL, HIFIVHI_CL, TEMPOPNW_CL, CAPTVAPN_CL, TEMPOPN_CL, HEARTRE, GLOBE, STRSBL, RIBBON_CL, STAR, KLICKPN_CL, CEOPEN_CL, CUBELEDK_CL, GEMINPNS_CL, INTOUCH, VIBRNTLP, SPRTYWAV_CL, LGTNLOOK, UND",LAZERBTL,30oz. Lazer Flat Bottle,44,"1-1/2""h x 2-1/4""w one side",BPA Free!    Flat bottle with decorative design along bottom.    Push pull lid with tethered cap.    Folds flat for easy storage.    Carabiner included.,One color imprint.,Silkscreen,,33,400,18L x 21W x 16H,,1. Carabiner not intended for climbing.  2. Carabiner not a perfect color match to handle and sipper.  3. Not intended for hot beverages.  4. Volume and shape of bottle varies according to content.  5. We strongly suggest requesting a sample of the neon c,150,250,500,1000,2500,3.85,3.65,3.49,3.25,2.99,C,C,C,C,C,"NEON ORANGE, NEON GREEN, NEON PINK, RED, BLUE",Drinkware,"STREABTL, DBLTKDS, WRPITUP, SPLSTOTE, DRSPTGL, COL3PKATH, PLYCLATH, TRSTRBG, CARLEYPN, CARDFOLI, CARLEYCL, CARASTRP, HLTHHND, TAGGEL, WATMEDPC, TRADEBDG, CAPBTLOP, LETHSTPK_CL, SONICKL_CL, MICRPHKY, TCHKYCN, MAGNIKL_CL, WHISTLE_CL, QUADCANV, COLKEVPK, SPI","flat foldable bottle, bpa free, summer2014, newneon, newsapril, summer, easy travel and storage"LCLREX,Executive L-Curve Padfolio,150,"7""h x 4-1/2""w","Stitched inside slip pocket with two mesh pockets.    Elastic pen loop.    Lined note pad with 30 sheets.    Actual size is 12-1/2""h x 9-3/4""w.",One color imprint.,Silkscreen,,,,,,1. We suggest using a 12pt. or larger size block font to ensure the best quality imprint.  2. Debossing not available.,60,120,240,480,960,9.69,9.19,8.69,8.19,7.69,C,C,C,C,C,SILVER/BLACK,Workplace,"SUNTOT, ZIPCOOL, GSRVTQSR, TCHKYCN, USBMTLKR, 16SATMUG, IWEARST, ELLSWORT, USBCHRM, YOGAMAT, 16JAMOCA, INSHPTOT, SMOOTHMV, SODATRIT, ENDUTRIT, TWICEBTL, TRVLBLKT, RIBBON, SFTYSTRB, LED17FLH, SILBRACP, PERFRBTL, SHOEKT, LNCHBDY, JAVAMUG, FOOTBL3, OVLTROPN,",LCLRJR,Jr. Executive L-Curve Padfolio,150,"5""h x 3""w","Stitched inside slip pocket with mesh pocket.    Elastic pen loop.    Lined note pad with 30 sheets.    Actual size is 8-3/4""h x 6-1/2""w.",One color imprint.,Silkscreen,,26,40,15L x 15W x 10H,,1. We suggest using a 12pt. Or larger size block font to ensure the best quality imprint.  2. Debossing not available.,80,160,240,480,960,6.69,6.39,5.89,5.39,4.99,C,C,C,C,C,BLACK W/SILVER TRIM,Workplace,"STANRMVR, SLICKCLR, MESNGBRA, QUADCANV, RTRMDLNG, PICNIC, ECMEDLNG, RIVET, MAGNAJMB, RIVIBAG, EXERBODY, EXECBAND, LENSCLN, RUBMSPD, RENPENC, GESSENBG, SAWYRSLV, WIDEMES, SAVVYPN, SOLARPN, MEMOCUBE, GOLFBALL, TTLPROV1, BERMDAEX, ELLSWORT, HANSPRAY, RETRAKY","padfolio, mesh, notepad, pen, loop, elastic"LCURVEJR,Jr. Executive L-Curve Padfolio,150,"5""h x 3""w","Stitched inside slip pocket with mesh pocket.    Elastic pen loop.    Lined note pad with 30 sheets.    Actual size is 8-3/4""h x 6-1/2""w.",One color imprint.,Silkscreen,,24,40,14L x 10W x 14H,,1. We suggest using a 12pt. Or larger size block font to ensure the best quality imprint.  2. Debossing not available.  3. Green  LCURVEJR has black interior accent colors.,80,160,240,480,960,6.69,6.39,5.89,5.39,4.99,C,C,C,C,C,"BLACK, BLUE, GREEN, RED",Workplace,"CHIAMNTY_CL, TRICRKSW_CL, SLMPKTL_CL, TWICEBTL, TAGGEL, VIVIDPN, 22FREDOM_CL, TETHGEL, HLTHHND, TRVSETBG_CL, CRWNGRPT_CL, RBSUNGLS, K2USBFAN, CARDFOLI, CLIPRND, HNDWARM, HATTRIKKT, STKPONKT, PIVTLKR_CL, PLYCLATH, MINMESH_CL, 17OUTBK, USBCOLTK, MINMANCF_CL","notepad, padfolio, mesh, elastic, pen, pocket"LCURVEX,Executive L-Curve Padfolio,150,"7""h x 4-1/2""w","Stitched inside slip pocket with two mesh pockets.    Elastic pen loop.    Lined note pad with 30 sheets.    Actual size is 12-1/2""h x 9-3/4""w.",One color imprint.,Silkscreen,,27,20,13L x 10W x 15H,,1. We suggest using a 12pt. Or larger size block font to ensure the best quality imprint.  2. Debossing not available.,60,120,240,480,960,9.69,9.19,8.69,8.19,7.69,C,C,C,C,C,"BLACK, BLUE",Workplace,"GRVGLWLT, OASISBTL, NIKISTPN, METPBKSK, MEALTOGO, ORBINF, MUTRDVTL, MASTRTL, PAPRNTOT, PNCFLBTL, TOOLARND, KPCLTWL, DBLTKDS, TALSBKSK_CL, THRDNSTD_CL, CRDLSO, VALETKR, CLRFILE_CL, BSKTBL, ARROW, CLRBRITE_CL, STREABTL, SOLCHRG, SVNUNOCP, SPLSTOTE, SPIRSTPN","pockets, elastic, mesh, padfolio, pen, notepad, pocket"LCURVEX_CL,Executive L-Curve Padfolio - Closeout,,"7""h x 4-1/2""w","Stitched inside slip pocket with two mesh pockets.    Elastic pen loop.    Lined note pad with 30 sheets.    Actual size is 12-1/2""h x 9-3/4""w.",One color imprint.,Silkscreen,,,,,,1. We suggest using a 12pt. Or larger size block font to ensure the best quality imprint.  2. Debossing not available.,,,,,,,,,,,,,,,,RED,Workplace,"CLAMFXLT, DIAMTMB, CLRTOTBG, DESMBPCK, TOGOTMB, TROOPTMB, MANHATTB, TURNTMB, NTROBKSK, FLEXFOLD_CL, FFORTCHG, PNKYHY, TWNTBCHG, BRANDCHG, RETROHS, LED17FLH, ULPOWBK, MINWNDFL, RULRCLSI, RETRFLSH, FLSHSTK, NOVLEDFL, PHZRFLSH, 27FLPFRE, BABBUBKG, FLIPBNDG, ",LED17FLH,17LED Aluminum Flashlight,272,"5/16""h x 1-1/4""w","17 LED lights.    Aluminum.    On/off switch with carry strap.    Actual size is 1-1/4""h x 5""w.    Individually gift boxed with batteries.",One laser engraved imprint.,Laser Engraved,,24,50,18L x 15W x 10H,Individually gift boxed with batteries.,Notes!  1. Batteries not inserted.  2. Silver is tone on tone engraving only.,50,100,250,500,1000,7.59,7.09,6.69,6.29,5.99,C,C,C,C,C,"BLUE, SILVER",Tools,"LNZSTPN, GRVGLWLT, OASISBTL, NIKISTPN, METPBKSK, MEALTOGO, MUTRDVTL, PAPRNTOT, PNCFLBTL, TOOLARND, UNOMUG, WVEBKPK, RLCPCLBG, TALSBKSK_CL, DRAWSWNW, DBLSTBPK, PEAKBKSK, THRDNSTD_CL, CRDLSO, TIDYUPKC, BOMBTSK, CALLCASH, BNDYBRT, TRIBSPK, ORBINF, WALLTOTE, ","aluminum, battery, led, strap"LEDLTBOK,Light Up Bottle Opener,287,"Option 1  or  2: 3/4""h x 3/4""w","Bright LED light illuminates bottle opener.    Split key ring attached.    On/off push button.    Actual size is 3-1/4""h x 1-3/4""w without key ring.    Individually polybagged.",One color imprint.,Silkscreen,,8,100,6L x 13W x 7H,Individually polybagged.,1. Imprint option  1 is standard.  2. Battery blocker inserted into on/off button. Remove blocker to turn on.,150,250,500,1000,2500,1.99,1.85,1.69,1.59,1.49,C,C,C,C,C,"FROST, BLUE, RED",Tools,"SODATRIT, BIOCUP, WTRTBPCH, TWICEBTL, VELOSTPN, SILISHOT, MULTTASK, LAZERBTL, PADPOD, TRSTAMBG, BRANDCHG, CLRSTYKC, CRVGRPBL, SPRINTSS, DBLWVSB, USBAUTO, FNTLBL, LNZSTPN, GLOBE, RIBBON, FOOTBL3, STRSBL, STAR, CAMOKLR, BUBKEG, RUBMSPD, 16SATMUG, BEVRCDCM, ","button, bottle opener, led, eqp, key ring, light"LEDTORCK,LED Torch Key Light,278,"5/8""h x 1-1/8""w","Bright single LED light with split key ring attached.    Push button mechanism.    Batteries included.    Actual size is 4-1/16""h x 1-5/16""w.    Individually polybagged.",One color imprint.,Silkscreen,,16,288,12L x 13W x 7H,Individually polybagged.,,150,250,500,1000,2500,1.47,1.4,1.33,1.26,1.19,C,C,C,C,C,"BLACK, BLUE, RED, SILVER, GREEN",Tools,"CITYLNH, KICKSTND, RETROHS, MULMDKPR, NOVLEDFL, STPLRMV, MULMDATH, SLIDACLP, SAVYHND, HABTSHP, SPRFNBTL, MINIWIPE, SILVCMBO, HSEKYHLD, NEOCLONE, METROBK, MINICHI, HOWDYTZR, LTDFLTBL, MESURCUP, SHAKITUP, STADBLKT, ITABSLV, MICRCLTH, MAZEPN, IWEARST, LED17F","button, bright, key ring, light, led, torch, batteries"LENSCLN,Lens Cleaner and Cloth,219,"Imprint Area: 1""h x 1""w  Labeled: 1-1/4""h x 1-1/2""w","1 ounce cleaning solution and microfiber cloth.    1.5% alcohol.    Actual size is 3-3/8""h x 1-5/8""w.    Individually polybagged.",One color imprint.,Silkscreen,,34,300,9L x 17W x 18H,Individually polybagged.,1. This item requires an additional 2 day production time.  2. No exact PMS match.  3. Cloth ships inside cap of item.  4. Imprint on cloth not available.,250,500,1000,1500,2500,1.99,1.89,1.75,1.63,1.55,C,C,C,C,C,WHITE,Lifestyles,"RLTRVMG, RLTRMBL, SHKCLRKT, TRSTRBG, SHKSDST, RLCPCLKT, TOGOTMB, MINIDESK, CARYTMB, EXECBAND, CARLEYCL, CARLEYPN, GAMEBLKT, DIVOTFXR, DSKMIR, DBLWVSB, FLEXRULE, FLIPBNDG, 17OUTBK, WIPEOUT, TRSTAMBG, GSDYTPJR, 16CORMUG, PNPALNBK, WONMAT, RUBMSPD, STYLPEN, ",LETHSTPK_CL,Leatherette Key Strap - Closeout,,"1/2""h x 1""w","Laser engraved. Silver plated alloy metal. Leatherette strap with metal split key ring. Hinged neck. Includes gift box. Actual size is 5""h x 1-1/4""w including ring.",One laser engraved imprint.,Laser Engraved,,,,,,,150,,,,,1.99,,,,,C,,,,,,Tools,"16JAMOCA, PNCFLBTL, 16CORMUG, SPORTDUF_CL, ACTSPBTL, SPRINTSS, CLEARVW_CL, GLIMMER, MP3MINI, SPRACLMC, CLENFTBT, HYDRAPK, BLAKEHI, HOWDYTZR, MAZECAL_CL, SLENDSIP, CRVGRPBL, SPRFNBTL, 17GEOBTL, PAPERCLP_CL, PAPRPENC, COLKONE, SLICKCLR, SHOTABST, CSTCK, RUB","laser, key ring, leatherette, strap, silver, hinge, neck"LGTNLOOK,Light N Look,171,"1-1/4""h x 1-1/4""w","Plastic magnifier light with on/off button.    Batteries included.    Large imprint area.    Actual size is 2""h x 4-3/4""w.    Individually polybagged.",One color imprint.,Silkscreen,,14,200,11L x 12W x 10H,Individually polybagged.,1. PMS color match is not available on multi color imprints.  2. Metallic and neon colors not available on multi color imprints.,150,250,500,1000,2500,2.69,2.55,2.35,2.19,1.99,C,C,C,C,C,"BLUE/SILVER, RED/SILVER, BLACK/SILVER, Silver",Workplace,"AUTOLNG, CALKTC, HABTSHP, KICKSTND, SOLSTPN, CRKSTBK, CANUSAVE, CAPRSTPN, 15ORBTMG, PNPALNBK, PNCFLBTL, CLRNBKSK, CABANAPN_CL, MANI2GO_CL, SPHRLTOP_CL, FXHEADPH, FLOS2GO_CL, HIFIVHI_CL, TEMPOPNW_CL, CAPTVAPN_CL, TEMPOPN_CL, LAPTPSLV_CL, HEARTRE, GLOBE, ST",LGTUPLYD,Light Up Lanyard,276,"3/4""h x 3/4""w","PVC necklace LED light with on/off and flashing feature.    Includes 2 CR2032 batteries with instruction card.    Actual size 14-1/2""l x 1-1/4""w at light end.",One color imprint.,Silkscreen,,40,230,13L x 18W x 17H,Individually polybagged.,,80,160,320,640,1280,4.99,4.79,4.29,3.99,3.69,C,C,C,C,C,"REFLEX BLUE, NEON YELLOW",Tools,"CTYCLRKT, CARRYCLR, MEDIASTA, CAMOFL, BUSCLGTG, 28BLEBTL, MANHATTB, GRPGRAN, 24ORBTMB, SVNUNOCP, 22GRPNGO, TOGOTMB, SSLENDSP, GOTOTE, NYLFLYER, 20INLET, PONZMNBG, PNCFLBTL, MUTRDVTL, MASTRTL, TPTPTMB, UNOCCLR, CARASTRP, WVEBKPK, BTLCAD, CARAKEYR, DBLSQBPK","batteries, bright, night, safety, flash, light, lanyard, led, necklace"LIPBALM,Lip Balm,259,"1-1/8""h x 1-3/4""w","Made in USA.    Lip balm with 15 SPF protection.    Contains beeswax, Vitamin E and aloe.    Fourteen flavor options: Mint, Natural, Berry, Vanilla,  Pomegranate, Citrus, Tropical, Blueberry, Bubble  Gum, Cherry, Grape, Orange, Pi a Colada, Root Beer,  St",White adhesive label with optional multicolor imprint.,Silkscreen,,16,700,12L x 9W x 15H,,1. No exact PMS color match.   2. This item requires an additional 2 day production time.    Click here to view stock label designs,250,500,1000,1500,2500,1.29,1.19,1.09,0.99,0.89,C,C,C,C,C,"POMEGRANATE, BERRY, MINT, NATURAL, VANILLA, CITRUS, TROPICAL, BLUEBERRY, BUBBLE GUM, CHERRY, GRAPE, ORANGE, PINA COLADA, ROOT BEER, STRAWBERRY, VANILLA-MINT, WATERMELON",Personal Care,"AEROBKSK, CAMOBKSK, DBLSQBPK, DRAWBKSK, DRAWSWNW, KCMSHBK, JETBKSK, RIVALBKS, SUNTOT, AUDIOEB, CORDKPR, TIDYUPKC, SUNSHDSQ, USBAUTO, WONMAT, RIVET, DIVOTFXR, 5TEEPKL, CYCLONE, GOLFTEE, 9TEEPKL, 5TEDVPKL, GESSENBG, SUNSPYLB, SIBLEYHI, SUPCHP, SILVHIGH, ARR",LNCHBDY,Lunch Buddy,66,"2""h x 5""w","Food storage container with three interior  compartments to keep food separated.    Lid has utensil storage.    Plastic fork and knife included.    Actual size is 7-1/4""h x 9-1/4""w x 1-1/2""d.",One color imprint.,Silkscreen,,24,60,22L x 20W x 27H,Individually polybagged.,,100,250,500,1000,2500,5.49,5.09,4.79,4.59,4.19,C,C,C,C,C,"BLUE, WHITE","Drinkware, Lifestyles","WATMEDPC, LENSCLN, BEACHNIK, CARDFOLI, LPMEDPCH, TRVBKPK, DRAWBKSK, DRAWSPRT, STCHSWKT, DENALIPN, VALETKR, THMGOB25, THMGOBTL, MESURCUP, SLIDACLP, COLKONE, SUNLOTON, SILISHOT, SPECTRA, MANSALON, SHKCLRKT, RLCPCLKT, STRAWGLT, SUNSPYLB, 20FLATFL, SOLSTPN, Y",LNCHBXST,Lunch Box Set,66,"1""h x 2""w","Lunch Box Set includes container with lid, 3 compartment nesting tray, cutlery set with knife, fork, and spoon.    Actual size is 6-1/2""h x 9""w x 2-1/2""d.",One color imprint,Silkscreen,,35,60,17L x 27W x 21H,,,100,250,500,1000,2500,5.69,5.49,5.19,4.99,4.59,C,C,C,C,C,REFLEX BLUE,"Lifestyles, Drinkware","FESTVLPN, UNDPRKLT, BEACHNIK, BIGLNGR, CYCLONE, LPMEDPCH, REEFBKSK, TAGGEL, HOWDYTZR, ONGOSANT, TRSTRBG, GETFITDF, TEMPOMT, DSKMIR, RIVALBKS, SHAKITUP, RIVET, PNPDSGNB, SUPCHP, RENPENC, QUASAR, TIRGEKYC, THMGOB25, SILIPINT, ENDUTRIT, PICNIC, STADBLKT, 27F",summer2014LNZSTPN,Lanza Stylus Pen,81,"1/2""h x 1-3/4""w","ABS plastic stylus pen, plunger/upper barrel, and tip is ABS.    Rubber tip color matches barrel of pen.",One color imprint,Silkscreen,,18,800,9L x 15W x 12H,,A silver imprint is recommended.  There is no set up charge on exact re-orders for writing instruments.,250,500,1000,2500,5000,1.35,1.25,1.09,0.99,0.89,C,C,C,C,C,"BLUE, RED, GRASS GREEN, ORANGE, PURPLE","Techno Trends, Writing Instruments","COBRAPN, ELLISTPN, WATMEDPC, OVLTROPT, SILIPOCK, HISTNTOT, JUBCLTOT, BAYCLTOT, EVERYSHP_CL, SALNTOTE, NITROGK, CAPRSTPN, CLAYPN_CL, TWISTPN, KLCSTK, NORDGRIP, TEMPOMT, JUPITPN, CRWNGRPT_CL, KLICKPN_CL, HANSPRAY, JETBKSK, TAGGEL, ASTRA_CL, YORKPEN, FLIPPOR",LOLATMBL,8oz. Lola Tumbler,,"1-1/2""h x 3""w",8oz. Double wall AS tumbler with lid.,One color imprint.,Silkscreen,,,,,,1. Non-microwaveable.    2. Hand wash only.    3. One side imprint recommended.,72,144,288,576,1008,5.79,5.55,5.29,5.09,4.99,C,C,C,C,C,"BLUE, AQUA, RED, CLEAR, FUCHSIA",Drinkware,"GRVGLWLT, NIKISTPN, METPBKSK, MEALTOGO, IWEARST, UNOMUG, DBLTKDS, TALSBKSK_CL, DRAWSWNW, KCMSHBK, THRDNSTD_CL, EARMEDIA, WRPITUP, MANSALON, CAPRSTPN, VIVIDPN, MINICHI, TEMPRPCK, RIBBON_CL, 12BISTRO, SWNKYTMB, COLKONE, SSLENDSP, SUNSHDE, 28BLEBTL, DRAWBKSK","prism lid, marchitems, double wall, summer2014, acrylic tumbler, wine"