Item# (SKU),Item Name,Catalog Page,Imprint Area,Product Description,Price Includes,Imprint Method 1,Imprint Method 2,Shipping Weight (lbs),Shipping Quantity,Shipping Dimensions (inch),Packaging,Additional Info,Pricing-Qty1,Pricing-Qty2,Pricing-Qty3,Pricing-Qty4,Pricing-Qty5,Pricing-Price1,Pricing-Price2,Pricing-Price3,Pricing-Price4,Pricing-Price5,Pricing-Code1,Pricing-Code2,Pricing-Code3,Pricing-Code4,Pricing-Code5,Available Colors,Product Categories,Related Products,Search KeywordsCLRTOTBG,Clear Through Tote Bag,,"4-1/2""h x 3-3/8""w","Clear 25mm PVC Tote Bag meets NFL and PGA size and imprint requirements for entrance into game day events.    Bag size is 12""h x 12""w x 6""gusset with 21"" webbed handles and reinforcement on front, back and side gussets.",One color imprint.,Silkscreen,,53,100,19L x 18W x 25H,,The PVC material in this bag meets CPSIA Phthalate requirements and is designed to meet CA Prop 65 Phthalate requirements.,100,250,500,1000,2500,5.79,5.65,5.35,5.09,4.89,C,C,C,C,C,"BLUE, BLACK, GREY",Bags,"YOGAMAT, CITYLNH, SLENDSIP, UNOCUP, STDCUP20, CFLYER, BIOCUP, WTRTBPCH, ACTSPBTL, TWICEBTL, SODATRIT, SILISHOT, VELOSTPN, MULTTASK, LAZERBTL, TRSTAMBG, BRANDCHG, PADPOD, CALLCASH, BMBONBK, SPRINTSS, USBAUTO, DBLWVSB, BNDYBRT, BASEBL, BSKTBL, ARROW, APPLE,","summer2014, marchitems, security, sports, events, tradeshows, bags, shopper, storage, handles, tote, conventions, nfl, pga, reusable, pvc, clear"CMPFRLGT,Campfire Light,276,"2""h x 1/2""w one side only.","Multifunction light 3 features: bright, dim and strobe.    Zoom capability with metal handle to hang.    Includes 3 AAA batteries with battery blocker.    Instruction card included.    Actual size 4""h x 1-1/2""w extends to 5-1/2""h.",One color imprint.,Silkscreen,,22,100,10L x 10W x 18H,,,50,100,250,500,1000,5.69,5.39,5.19,4.69,4.29,C,C,C,C,C,"YELLOW, REFLEX BLUE",Tools,"CTYCLRKT, CARRYCLR, BUSCLGTG, 28BLEBTL, MANHATTB, HANCCKPN, GRPGRAN, GOTOTE, NYLFLYER, SILICOME, BEACHNIK, HNDWARM, SUNSPYLB, WATMEDPC, SWAMPJUI, 20FLATFL, RULRCLSI, 17GEOBTL, SUMMCMBO, LPMEDPCH, AUDIOEB, 16ORBTMB, SPLSTOTE, 16GRPSS, FORCSTUM, SILIPINT, C","light, outdoor14, camp, fire, bright, outdoors, strobe, wilderness"COBRAPN,Cobra Pen,88,"1-1/4""h x 1-1/2""w","Plastic barrel pen.     Actual size 5-5/8"".     Twist mechanism.     Black refill.",One color imprint.,Silkscreen,,,,,,There is no set up charge on exact re-orders for writing instruments.,500,750,1000,2500,5000,0.99,0.89,0.75,0.59,0.49,C,C,C,C,C,"Orange, Red, White, Aqua",Writing Instruments,"BARBRTLT, GRVGLWLT, PNCFLBTL, WILSNGLS, ASTRA_CL, ASTRAT_CL, SPRTYWAV_CL, OCEANPN_CL, CAPTVAPN_CL, TEMPOPNW_CL, GEMINIPN_CL, QUADCLPN_CL, TONTGLPN_CL, GEMHIPNS_CL, GEMINPNS_CL, TEMPOPN, VIVIDPN, CARNVPRO, MAZEPN, SUMITPEN, CARLEYCL, OASISBTL, NIKISTPN, ME",COL3PKATH,Collapsible Kan Cooler Event Pack,232,"Collapsible Kan Coller:2-1/2""h x 3""w  each side        Golf Ball:7/8"" diameter       Divot Ball marker:1/2"" diameter ball maker and 1/2""h x 3/4""w divot repair tool       Golf Tees: 7/16""h x 1-3/8""w","Contains Collapsible Kan Cooler, three Authoritee  Golf Balls, nine 2-3/4"" Golf Tees and Divot Ball Marker.    Individually polybagged.","One color imprint on each item in the pack, 1-4 color imprint on one pole of the golf balls.",Silkscreen,,31,80,9L x 23W x 17H,Individually polybagged.,1. This item requires an additional 2 day production time.    2. PMS color match not available.    3. Less than 1st column quantity not available.    4. Golf ball imprint will not be at exact polar opposite sides.  5. Free spec sample product exceptions i,72,144,288,576,1008,10.29,9.79,9.34,8.66,7.89,C,C,C,C,C,,Lifestyles,"16JAMOCA, PNCFLBTL, 16CORMUG, SPORTDUF_CL, ACTSPBTL, CLEARVW_CL, MP3MINI, SPRACLMC, HYDRAPK, MAZECAL_CL, 17GEOBTL, PAPERCLP_CL, SLICKCLR, SHOTABST, CSTCK, SILISHOT, SILIPINT, NIKISTPN, PADPOD, SHOEKT, MEALTOGO, BUBKEG, PLASFAN, 34BUBTVL, BELLATMB, BEVRCDC","golf, divot, golfkit14, collapsible, ball, tournament"COLDUF_CL,Coliseum Duffel Bag - Closeout,,"3-1/2""h x 6-1/2""w","600D polycanvas.    Front pocket, adjustable shoulder strap and  carry handle with zippered closure.    Side mesh pocket.    Actual size is 11""h x 17""w x 10"" gusset.",One color imprint.,Silkscreen,,,,,,3 day production from time of art approval.,,,,,,,,,,,,,,,,"BLACK/BLUE, BLACK/BLACK",Bags,"ACTDUFL_CL, CARRYON, EVERYTOT, SPORTDUF_CL, RDTRPPR, TRADEBDG, FNTLBL, FOOTBL3, TOOLARND, MINIDESK, MNLNTRL, USBCHRM, OVLTROPN, OVLTROPT, HYLANDPF, LIPBALM, PROPITUP, FXHEADPH, SPHRLTOP_CL, MANI2GO_CL, JAVAMUG_CL, TRINJR_CL, TRINEXC_CL, CERENJR, CATLINEX,",COLKEVPK,Collapsible Kan Cooler Event Pack,234,"Collapsible Kan Cooler: 2-1/2""h x 3""w each side       Divot Ball Marker: 1/2""diameter ball marker and 1/2""h x 3/4""w divot repair tool       Golf Tees: 7/16""h x 1-3/8""w","Contains Collapsible Kan Cooler, nine 2-3/4""Golf Tees and Divot Ball Marker.    Individually polybagged.",One color imprint on each item in the pack.,Silkscreen,,13,175,9L x 23W x 17H,Individually polybagged.,1. This item requires an additional 2 day production time.    2. Less than 1st column quantity not available.    3. PMS color match not available.  4. Free spec sample product exceptions include all of the above stated in EQP exceptions. Spec sample decor,72,144,288,576,1008,4.09,3.89,3.69,3.49,3.29,C,C,C,C,C,,Lifestyles,"CERENJR, 20STD2GO, GAMEBLKT, GOLFBALL, FLOS2GO, DSKMIR, DBLWVSB, FLEXRULE, EXECFLG, EXERBODY, FLIPBNDG, 17OUTBK, WIPEOUT, TRSTAMBG, GSDYTPJR, 16CORMUG, PNPALNBK, MINIWRIT, WONMAT, RUBMSPD, MULTTASK, STYLPEN, SOLARPN, STCROPNM, MESNGBRA, TTLNXTTR, STCROPNW","koozie, cooler, can"COLKKLR,Collapsible Foam Kan Cooler,70,"2-1/2""h x 3""w each side","Cloth exterior with felt-lined interior.    2-sided imprint.    Actual size flat is 5-1/8""h x 4""w.    Actual size open is 4-1/8""h x 2-3/4""diameter.",One color imprint on 2 sides,Silkscreen,,11,500,24L x 16W x 17H,Bulk,Metallic Gold imprint is not recommended.,250,500,1000,2500,5000,0.99,0.95,0.89,0.85,0.79,C,C,C,C,C,"MAROON, BLACK, DARK GREEN, NAVY, PURPLE, RED, ROYAL BLUE, YELLOW, ORANGE, PINK, KHAKI, GREY, LIME GREEN","Drinkware, Coolers","GOTOTE, SILIPOCK, DRAWSWNW, SILICOME, ELRYKYLT, CRDLSO, FLEXRULE, YOGAMAT, 24REVOTL, JETBKSK, SMOOTHMV, SLENDSIP, 6PKWAVE, BIOCUP, SILBRACD, SILBRACP, STDCUP20, ARROWCLP, CLIPRND, SUNSHDE, MINIWRIT, ORBTRNL, KLPNOTES, CINBKPN, MGNTCLDP, 20INLET, NTROBKSK,","can, koozies, koozie, cup, felt, flat, larger, lined, mardigras, foam, flattens, cooler, coolers, cloth, soda, tangerinetango"COLKONE,Collapsible Foam Kan Cooler,70,"2-1/2""h x 3""w one side","Cloth exterior with felt-lined interior.    1-sided imprint.    Actual size flat is 5-1/8""h x 4""w.    Actual size open is 4-1/8""h x 2-3/4""diameter.",One color imprint on one side.,Silkscreen,,,,,Bulk,Metallic Gold imprint is not recommended.,250,500,1000,2500,5000,0.64,0.62,0.59,0.57,0.55,C,C,C,C,C,"KHAKI, GREY, PURPLE, YELLOW, BLACK, ROYAL BLUE, PINK, MAROON, LIME GREEN, NAVY, DARK GREEN, RED, ORANGE","Drinkware, Coolers","MESURCUP, SSLENDSP, LEDLTBOK, TREKRTUM, SLIDMAG, SLIDACLP, ORBTRNL, KLCSTK, CSTCKS, 22FREDOM, GLFPKATH, PNPXLNB, ITABSLV, KICKSTND, STRAWGLT, STRAWSTP, CARLEYPN, STCROPNF, YORKPEN, CRSCALEX, LCURVEJR, LTDFLTBL, CRSCALJR, LCLRJR, SPRFNBTL, NEOFLAT, RETRAKY","foam, cup, felt, flat, flattens, lined, koozie, koozies, larger, coolers, cooler1, cooler, cloth, can, soda"COLRNKT,Cool Run Kit,200,"Coolrunning Backsack: 7""h x 7""w  Keep It Cool Towel: 1-1/2""w x 6""h  container only",Kit includes a Coolrunning Backsack and a Keep it Cool Towel.,One color imprint on each item.,Silkscreen,,,,,,"Backsack comes in Grey, Aqua, or Red. Keep it Cool Towel comes in Yellow, Blue, Orange, or Grey.",64,128,256,512,1024,11.99,11.39,10.79,10.39,9.99,C,C,C,C,C,"Grey, Aqua, Red",Bags,"CLRFILE, CLRFILE_CL, CLPCPHAN, BSKTBL, ARROW, CLRBRITE_CL, CARATIZE, SICWINBG, STREABTL, SOLCHRG, SVNUNOCP, SPLSTOTE, SPIRSTPN, SPRINBTL, SILIPOCK, SILICOME, SPINPWBK, SCENRVBR, RLTRVMG, QUENBTL, POWBANK, RLTRMBL, PRISTMB, SELFCAM, PONZMNBG, PSHPWUSB, SAL",COMJOTPN,Composition Jotter Pad w/ Pen,159,"2""h x 1-7/8""w","Translucent colors.    Extra hard plastic cover.    Matching mini pen with retractable mechanism locks the cover.    Release button on side of pen.    Unlined pad with 80 sheets.    Actual size is 4-1/8""h x 3""w.   Individually polybagged.",One color imprint on jotter pad.,Silkscreen,,25,200,11L x 17W x 10H,Individually polybagged.,1. We suggest using a 12pt. or larger size block font to ensure the best quality imprint.  2. Pen imprint not available.,150,250,500,1000,2500,1.69,1.59,1.53,1.39,1.29,C,C,C,C,C,"WHITE, SMOKE, LIME GREEN, NEON ORANGE, BLUE, RED",Workplace,"WIDEMES, RTRMDLNG, HATTRKBO, WRIONCLP_CL, FLDGOBG_CL, RLCPCLKT, MGNTCLDP, QUADCLPN_CL, CLPSFSTB_CL, SHKCLRKT, CTYCLRKT, CARAKEY6_CL, SPRGRBR_CL, LENSCLN, EYESGTST, FRVWPENC_CL, WRITEBOX_CL, GSSLEEK, SILNTHI_CL, AUTOLNG, CLRSTYKC, MAGNAJMB, MICRCLTH, MICRO","pad, pen, plastic, matching, retractable, sturdy, jotter, tangerinetango, unlined"COMMTOT,Commuter Tote Bag,195,"5""h x 5""w","600D polycanvas.    Zip closure. 23-1/2"" handles.    Actual size is 14""h x 18""w x 4"" gusset.",One color imprint.,Silkscreen,,23,50,19L x 15W x 10H,Bulk.,,100,250,500,1000,2500,5.79,5.65,5.35,5.09,4.79,C,C,C,C,C,"AQUA BLUE, RED",Bags,"TIRGEKYC, UNOLED, INTOUCH, SICWINBG, RIVIBAG, MINISTKY, MINIATH, 16CORCLR, CHRODLUX, MAGNACLP, STDCUP20, JAVAMUG, CARAKEYR, BTLCAD, MULMDATH, NITROGK, VIVDCMBO, UNDPRKLT, UNOMUG, UNIUSB, TRVBKPK, HATCHBAG, SUNSHDE, SUNSHDSQ, FLSHSTK, NOVLEDFL, TECCHGST, S","tradeshows, totes, summer, carry, beach, bags, color surge, handles, shopping, colors, nvlat, polycanvas, reusable, zip, zipper"CONCORD,Concord Pen,86,"5/8""h x 1-1/2""w",Dimpled plastic grip.    Chrome plunger & tip.    Retractable mechanism.    Medium point black refill.,One color imprint.,Silkscreen,,20,600,13L x 13W x 7H,,There is no set up charge on exact re-orders for writing instruments.,500,750,1000,2500,5000,0.63,0.6,0.55,0.48,0.45,C,C,C,C,C,"SMOKE, RED, BLUE",Writing Instruments,"NIKISTPN, TWISTPN, LYNXPEN_CL, PIGGYBNK, TAGGEL, 22FREDOM_CL, TETHGEL, TRVSETBG_CL, CRWNGRPT_CL, NEOCLTWO, HATTRIKKT, STKPONKT, PIVTLKR_CL, PLYCLATH, MINIATH, MINMESH_CL, ZIPCOOL, MINMANCF_CL, EZFILPKT_CL, TERRNBK_CL, TERRNBK, SFTYSTRB, MESNGBRA, NYLFLYER","plastic, retractable, dimpled, chrome"COPERCSE,Cooper Tablet Case,109,"Silk Screened: 3""h x 6""w   Debossed: 3""h x 4""w","Debossing available.    Leather-like portfolio for tablets.    Velvet-like inside and snap tab closure.    Fits devices from 8-1/2""h x 6-1/4""w to 9-3/8""h x 7-1/4""w.    Actual size is 9-3/4""h x 8-1/2""w.",One color or debossed imprint.,Silkscreen,Deboss,20,20,11L x 18W x 17H,,1. There is an additional 5 day production time for debossing.  2. We suggest using a 12pt. or larger size block font to ensure the best quality imprint.,80,160,240,480,960,7.99,7.59,7.19,6.79,6.49,C,C,C,C,C,BLACK,"Techno Trends, Workplace","MTYBRITE, MINIATH, SPRINTSS, LAZERBTL, STYLITE, BEACHNIK, CLPSLNCH, CLRTOTBG, CTYCLRKT, 24REVOTL, 9TEDVPKL, 6PKTPATH, 5TEEPKL, 16ORBTMB, 34BUBTVL, BUBKEG, BBUY, CLRBLKBK, COMMTOT, DBLSQBPK, DBLSTBPK, DRAWSWNW, FTNSDUFL, GOTOTE, HYDRAPK, HABTSHP, MINICHI, ",CORDKPR,Cord Keeper,119,"1-1/4"" diameter","Manage your cords!    Simply wrap cord around the keeper to neatly store or travel with.    Actual size is 1-3/4""d.    Individually polybagged.",One color imprint.,Silkscreen,,12,500,12L x 12W x 10H,Individually polybagged.,,250,500,1000,1500,2500,1.09,0.99,0.93,0.86,0.79,C,C,C,C,C,"BLACK, BLUE, WHITE, RED, LIME",Techno Trends,"SLIDACLP, CRKSTBK, RETRVKL, TIRGEKYC, TIREGE, MESURCUP, SILIPOCK, SILICOME, WEBTOTE, CRDLSO, ALBCOKC, KICKSTND, MEDIASTA, MEDILNGS, AUDIOEB, MICROSTD, CELLALNG, ITABSLV, CALIOPRO, CARNVPN, CARNVPRO, FESTVLPN, MEDIALNG, MULMDKPR, USBMTLKR, 20DWREV, 20FLATF",CORKSLV,Corky Tablet Sleeve,158,"4""h x 6""w","Cork tablet holder padded with elastic closure.     Approx. size is 10-1/2""h x 8-1/4""w.     Fits devices up to 10""h x 7-3/4""w.",One color imprint.,Silkscreen,,14,40,12L x 18W x 11H,,We suggest using a 12pt. or larger size block font to ensure the best quality imprint.,60,120,240,480,640,10.19,9.85,9.6,9.35,8.99,C,C,C,C,C,Cork,Workplace,"LNZSTPN, GRVGLWLT, OASISBTL, NIKISTPN, METPBKSK, MEALTOGO, ORBINF, MUTRDVTL, MASTRTL, PAPRNTOT, PNCFLBTL, TOOLARND, IWEARST, KPCLTWL, BUBKEG, UNOMUG, WVEBKPK, RLCPCLBG, DBLTKDS, TALSBKSK_CL, DRAWSWNW, DBLSTBPK, KCMSHBK, PEAKBKSK, CITYLNH, THRDNSTD_CL, CRD",COVCLBD,Covington Clipboard,151,"1-1/4""h x 6""w","Leather-like clipboard with pen loop and  back pocket.    Fold over leather-like flap has magnets to  secure paper and holds up to 20 sheets.    Actual size is 13-1/4""h x 9-1/8""w.",One color imprint.,Silkscreen,,26,40,14L x 10W x 15H,,1. We suggest using a 12pt. Or larger size block font to ensure the best quality imprint.  2. Imprint available on flap only.,80,160,240,480,960,6.49,6.25,6.05,5.85,5.49,C,C,C,C,C,"BLACK, BLACK/RED, BLACK/REFLEX BLUE",Workplace,"RLTRMBL, FACILTP, AUTOLNG, INTOUCH, RETRFLSH, ECMEDLNG, TCHKYCN, SUPCHP, ZIPCOOL, GSRVTQSR, SILBTLKC, IWEARST, PNPXLNB, CFLYERT, KLPNOTES, USBCHRM, INSHPTOT, NTROBKSK, ENDUTRIT, TREKRTUM, GSDAYTRP, MINICHI, USBPEN, USBTWIST, SFTYSTRB, LED17FLH, PERFRBTL, ",COZYCASE_CL,Cozy Case - Closeout,,"2""h x 1-1/2""w","Holds popular cell phone and MP3 players, including iPhone  and Razr . Plastic carabiner clip. Webbing strap belt loop. Elastic gussets on sides and bottom hold devices securely. Actual product size is 4-1/2""h x 2-1/2""w.",One color imprint.,Silkscreen,,,,,Bulk.,,150,,,,,0.6,,,,,C,,,,,,Techno Trends,"FLEXFOLD_CL, THPKHLD, FLIPBNDG, RDTRPPR, TRADEBDG, FNTLBL, FOOTBL3, TOOLARND, MINIDESK, MNLNTRL, USBCHRM, OVLTROPN, OVLTROPT, HYLANDPF, LIPBALM, PROPITUP, FXHEADPH, SPHRLTOP_CL, MANI2GO_CL, FACILTP, MAZEPN, DREMJRNL_CL, PIGLETBK, USBTWIST, STPLRMV, GELEHI",CRDLSO,Cord Lasso,166,"3/8""h x 3/4""w","PVC Cord wrap perfect for computers, gaming systems, and other electronics.    Actual size 5-1/16""h with square end 1-3/16""w.    Individual polybagged.",One color imprint.,Silkscreen,,24,2000,19L x 15W x 13H,Individual polybagged.,,500,1000,1500,2500,5000,1.19,1.09,0.99,0.89,0.79,C,C,C,C,C,"RED, ORANGE, YELLOW, BLUE, GREEN",Workplace,"SOLARPN, POWBANK, NVLATBJR, LNZSTPN, BNDYBRT, BEACHNIK, CLASSTRAV, ELLSWORT, GRPBOLD, HATTRIKKT, HATTRKBO, MEDIASTA, PEAKBKSK, RTRMDLNG, SIPNSTYL, SWNKYTMB, UNOCCLR, ZGZGBKSK, LNCHBXST, CRKSTBK, CRKNTBK, FLEXIBWL, CLPSLNCH, EYESGTST, SHKSDST, RLCPCLBG, CR",CRESTEX,Executive Crescent Padfolio,146,"Silk Screened: 7""h x 4-1/2""w     Debossed: Location 1:  4""h x 4""w Location 2:  1-1/2""h x 4""w","Debossing available.    AlluraHyde cover with slip pocket on front.    Lined note pad with 30 sheets.    Heat sealed inside slip pocket, business card holder with window and pen loop.    Actual size is 12-1/2""h x 9-3/4""w.",One color or debossed imprint.,Silkscreen,Deboss,28,20,14L x 17W x 11H,Bulk. Individually polybagged.,"1. We suggest using a 12pt. or larger size block font to ensure the best quality imprint.  2. This item requires an additional 5 day production time for debossing.  3. For debossing, imprint location  1 is standard.",60,120,240,480,960,9.99,9.59,8.79,8.29,7.99,C,C,C,C,C,BLACK,Workplace,"STELNBK, STANRMVR, SLICKCLR, MESNGBRA, RTRMDLNG, PICNIC, ECMEDLNG, DBLVISN, RIVET, SHOEBAG, MAGNAJMB, COLKEVPK, RIVIBAG, EXERBODY, EXECBAND, LENSCLN, MICRCLTH, RUBMSPD, SLKMPNCL, EXMANPNC, RENPENC, PAPRPENC, GSSLEEK, GESSENBG, SAWYRSLV, WIDEMES, PIGGYBNK,","padfolio, notepad, debossing, business, access, pen, pocket, sized, pencil"CRESTJR,Jr. Executive Crescent Padfolio,146,"Silk Screened:5""h x 3""w     Debossed: Location 1:  2-1/2""h x 2-1/2""w Location 2:  1-1/4""h x 2-3/4""w.","Debossing available.    AlluraHyde cover with slip pocket on front.    Lined note pad with 30 sheets.    Heat sealed inside slip pocket, business card holder and pen loop.    Actual size is 8-3/4""h x 6-1/2""w.",One color or debossed imprint.,Silkscreen,Deboss,28,40,14L x 10W x 16H,,"1. We suggest using a 12pt. or larger size block font to ensure the best quality imprint.  2. This item requires an additional 5 day production time for debossing.  3. For debossing, imprint location  1 is standard.",80,160,240,480,960,6.29,5.79,5.29,4.99,4.79,C,C,C,C,C,BLACK,Workplace,"CERENJR, CRESTEX, CATLINEX, CRSCALEX, HYLANDPF, LCURVEJR, CRSCALJR, LCLRJR, LCURVEX, COMJOTPN, VIKINGPN, TETHGEL, PNPALNBK, 20TINTBB, 12GRPNGO, TERRNBK, 30POLYCL, SILBTLKC, EXECFLG, 14PATTMB, 20STD2GO, 9TEDVPKL, 6PKTPATH, 16GRPSS, CLPSAFLS, SUNSCRGK, 18HY","debossing, pen, notepad, business, access, padfolio, pencil, pocket, sized"CRKNTBK,Corky Notebook,154,"4""h x 3-1/2""w","Leather-like cork pattern notebook with 80 sheets of ecru colored lined paper with ribbon bookmark.    Actual size 5""w x 7""h.",One color imprint.,Silkscreen,,25,50,7L x 15W x 16H,,We suggest using a 12pt. or larger size block font to ensure the best quality imprint.,150,250,500,1000,2500,4.29,4.09,3.95,3.69,3.39,C,C,C,C,C,CORK,Workplace,"HEROHT, HANCCKPN, 22FREDOM, 16KARTMB, WATMEDPC, DRAWSWNW, JETBKSK, DBLTKDS, METROBK, STADBLKT, SPLSTOTE, DRSPTGL, PLYCLATH, COL3PKATH, MINIATH, SUNSCRGK, NITROGK, GSHOPKATH, MULMDATH, USBPEN, ALCHCMBO, CINBKPN, CTYCLRKT, CARRYCLR, MEDIASTA, CAMOFL, BUSCLG","cork, journal"CRKSTBK,Corky Sticky Notes,161,"3""h x 2-1/2""w","Leather-like cork pattern sticky notes pad.    25 sheets each of flag notes and 50 sheets of larger notes.    Actual size 4-1/4""h x 3-1/4""w.",One color imprint.,Silkscreen,,18,100,8L x 15W x 9H,,We suggest using a 12pt. or larger size block  font to ensure the best quality imprint.,150,250,500,1000,2500,2.69,2.55,2.39,2.19,1.99,C,C,C,C,C,CORK,Workplace,"SILBRACP, MAGNAJMB, CLIPRND, ESQPEN, COVCLBD, MAGNACLP, SNGLSCPM, CLPSAFLS, PENCIL, GLOBE, RIBBON, STRSBL, STAR, FOOTBL3, CAMOKLR, SLICKCLR, TETHGEL, 20STD2GO, RUBMSPD, BUBKEG, 16SATMUG, 16GRPNGO, 18FLPFRE, 16CORMUG, JAVAMUG, BABBUBKG, 16JAMOCA, SHOEKT, S",CRSCALEX,Executive Crescent Calculator Padfolio,147,"Silk Screened: 7""h x 4-1/2""w      Debossed Location 1: 4""h x 4""w    Location 2: 1-1/2""h x 4""w","Debossing available.    Includes solar powered calculator.    AlluraHyde cover with white contrast stitching and a slip pocket.    Lined note pad with 30 sheets.    Three heat sealed inside pockets and pen loop.    Actual size is 12-1/2""h x 9-3/4""w.",One color or debossed imprint.,Silkscreen,Deboss,31,20,13L x 10W x 16H,,"1. We suggest using a 12pt. or larger size block font to ensure the best quality imprint.  2. This item requires an additional 5 day production time for debossing.  3. For debossing, imprint location  1 is standard.",60,120,240,480,960,11.99,11.59,10.99,10.49,9.99,C,C,C,C,C,BLACK,Workplace,"STANRMVR, SLICKCLR, MESNGBRA, QUADCANV, RTRMDLNG, PICNIC, ECMEDLNG, RIVET, MAGNAJMB, RIVIBAG, EXERBODY, EXECBAND, LENSCLN, RUBMSPD, RENPENC, GESSENBG, SAWYRSLV, WIDEMES, SAVVYPN, SOLARPN, MEMOCUBE, GOLFBALL, TTLPROV1, COMJOTPN, CATLINEX, CRESTEX, CRESTJR,","stitching, solar, pocket, padfolio, debossing, lined, note, powered"CRSCALJR,Jr. Executive Crescent Calculator Padfolio,147,"Silk Screened: 5""h x 3""w       Debossed Location 1: 2-1/2""h x 2-1/2""w    Location 2 : 1-1/4""h x 2-3/4""w","Debossing available.    Includes solar powered calculator.    AlluraHyde cover with white contrast stitching and a slip pocket.    Lined note pad with 30 sheets.    Two heat sealed inside pockets and pen loop.    Actual size is 8-3/4""h x 6-1/2""w.",One color or debossed imprint.,Silkscreen,Deboss,32,40,20L x 14W x 10H,,"1. We suggest using a 12pt. or larger size block font to ensure the best quality imprint.  2. This item requires an additional 5 day production time for debossing.  3. For debossing, imprint location  1 is standard.",80,160,240,480,960,8.99,8.59,7.99,7.49,6.99,C,C,C,C,C,BLACK,Workplace,"ELLSWORT, 14PATTMB, DRYITTWL, STANRMVR, SLICKCLR, MESNGBRA, QUADCANV, RTRMDLNG, PICNIC, ECMEDLNG, RIVET, MAGNAJMB, RIVIBAG, EXERBODY, EXECBAND, LENSCLN, RUBMSPD, RENPENC, GESSENBG, SAWYRSLV, WIDEMES, SAVVYPN, SOLARPN, MEMOCUBE, GOLFBALL, TTLPROV1, SUPCHP,","note, calculator, debossing, padfolio, powered, solar, stitching, lined, pocket"CRVGRPBL,24oz. Curve Grip Bottle,47,"Option 1:  at bottom  1-3/4""h x 2-1/2""w one side only or  Option 2: 1-3/4""h x 8""w wrap","BPA Free!    24oz. Stainless steel bottle with rubber matte finish with push/pull lid, finger loop, and cap with tether.",One color imprint.,Silkscreen,,23,50,13L x 30W x 16H,,"1. This item requires an additional one day production time.  2. Non-microwavable.  3. Please indicate imprint option on PO. If no option is given, option  1 is standard.",50,100,200,400,800,9.29,8.99,8.39,7.89,7.49,C,C,C,C,C,"BLACK, REFLEX BLUE, RED",Drinkware,"RLTRMBL, TRENTUM, FORCSTUM, BELMSTPN, NOVLEDFL, PHZRFLSH, TRA9LED, EXECBAND, EXERBODY, HEROHT, HANCCKPN, WATMEDPC, QUASAR, DRAWSWNW, JETBKSK, DBLTKDS, METROBK, GETFITDF, SPLSTOTE, DRSPTGL, PLYCLATH, COL3PKATH, MINIATH, SUNSCRGK, NITROGK, GSHOPKATH, MULMDA","push pull lid, rubber matte finish, bpa free, hearthealth, finger loop, cap, stainless steel"CRWNGRPT_CL,Crown Grip Pen - Closeout,,"5/8""h x 2""w",Plastic barrel pen with a grip.    Medium point black refill.    Transparent colors.,One color imprint.,Silkscreen,,,,,Bulk.,There is no set up charge on exact re-orders for writing instruments.,,,,,,,,,,,,,,,,"BLUE, BLACK, Purple, RED, YELLOW",Writing Instruments,"PARAPN, CRVGRPBL, WIDEMES, GAMEBLKT, GETFITDF, ELLSWORT, SHARKMCL, RTRMDLNG, ITABSLV, KICKSTND, HATTRKBO, ASTRA_CL, CAPTVAPN_CL, ECOCLK_CL, GEMINPNS_CL, MARCOPN_CL, OCEANPN_CL, TREMEBRT_CL, GEMINIPN_CL, CLAYPN_CL, TEMPOPN_CL, QUADCLPN_CL, CSTCK, WRIONCLP_",CSTCK,Crown Stick Pen,85,"3/4""h x 1-1/2""w",White barrel.    Our best selling pen.    Medium point black refill.,One color imprint.,Silkscreen,,,,,,There is no set up charge on exact re-orders for writing instruments.,1000,2500,5000,7500,10000,0.31,0.28,0.25,0.24,0.22,C,C,C,C,C,"WHITE/NAVY, WHITE/GREEN, WHITE/BLACK, WHITE/RED, WHITE/BLUE, WHITE/ORANGE, WHITE/HUNTER GREEN",Writing Instruments,"VWINOPN, UNOLED, LETHSTPK_CL, SONICKL_CL, MICRPHKY, RETRVKL, RIVET, MAGNIKL_CL, WHISTLE_CL, QUADCANV, COL3PKATH, COLKEVPK, METROBK_CL, PEAKBKSK, GRPBOLD, RIVIBAG, RIVIBAG_CL, CHRODLUX, CHROMLNH_CL, HATCHBAG, CAMOFL, BTLBUDKR_CL, LUGSTRAP_CL, CARASTRP, HAT","colors, solid, stick pen"CSTCKS,Crown Stick Pen Solid,85,"3/4""h x 1-1/2""w",Solid barrel.    Our best selling pen.    Medium point black refill.,One color imprint.,Silkscreen,,,,,,There is no set up charge on exact re-orders for writing instruments.,1000,2500,5000,7500,10000,0.31,0.28,0.25,0.24,0.22,C,C,C,C,C,"BLUE, GREEN, RED, BLACK, WHITE, NAVY BLUE",Writing Instruments,"HANSPRAY, RETRAKYR, RETRFLSH, 24REVOTL, LEDTORCK, SUPCHP, CLPSAFLS, SNGLSCPM, RTBADG, KLPNOTES, LUGSPTOR, SHOWTOTE, LONGTEES, STADBLKT, CLRFILE, MTYBRITE, COMMTOT, GOLFTOWL, 14FLATSN, 27FLPFRE, FLIPBNDG, CALKTC, 20FLATFL, 16SATTMB, MEDIALNG, MEDILNGS, USB","pen, stick, solid"CTYCLRKT,City Cooler Kit,,"City Style Lunch Bag: 3""h x 4""w  Lunch Box Set: 1""h x 2""w  16oz. Uno Cup: 1-1/2""h x 2-3/4""w each side or  1-1/2""h x 7-1/2""w wrap","Includes City Style Lunch Bag, Lunch Box Set, and 16oz. Uno Cup with lid.    Each item color is to be noted on PO.    Additional colors are available.     Also available sold separately.",One color imprint on each item.,Silkscreen,,13,13,13L x 27W x 13H,,1. This item requires an additional 2 day production time.    2. Color Surge charges apply. Consult customer service rep for details.,50,100,250,500,1000,12.99,12.29,11.79,11.39,10.99,C,C,C,C,C,,"Lifestyles, Drinkware, Coolers","RDTRPPR, PHNTMFLS, RETRVKL, PNKYHY, POWBANK, PEAKBKSK, PONZMNBG, PNCFLBTL, NMDTRAD, MGNTCLDP, MUTRDVTL, MASTRTL, MINIWIPE, LOLATMBL, MANHATTB, MNLNTRL, NVLATBCS, TPTPTMB, UNOCCLR, DLXPICCL, CMPFRLGT, WVEBKPK, DBLSQBPK, DBLSTBPK, BTLCAD, CRVGRPBL, TIDYUPKC","coolerkits14, summer2014"CTYSLKNB,City Slicker Notebook,154,"2-1/2""h x 3-1/2""w","Oxford covered notebook with leather-like patch.    80 sheets of ecru colored lined paper.    Actual size 8""h x 6""w.",One color imprint.,Silkscreen,,32,50,10L x 16W x 15H,,We suggest using a 12pt. or larger size block font to ensure the best quality imprint.,60,120,240,480,960,5.79,5.59,5.09,4.69,4.29,C,C,C,C,C,BLACK OXFORD / BROWN,Workplace,"SSLENDSP, 22GRPNGO, USBCOLTK, MEDIASTA, CLRSTYKC, ZGZGBKSK, CALKTC, RTBADG, CSTCK, LUGSPTOR, STADBLKT, LONGTEES, CLRFILE, SHOWTOTE, COMMTOT, MTYBRITE, CABANAPN, 17OUTBK, 27FLPFRE, FLIPBNDG, FESTVLPN, 16SATTMB, MEDILNGS, MEDIALNG, GLIMMER, SILVHIGH, USBTWI",spiral notebookCUBELEDK_CL,Cube LED Key Light - Closeout,,"1/2""h x 1-1/4""w","Pull out - push in to turn light on and off.    Battery included.    Split key ring attached.    Actual size is 3/4"" h x 2-1/4""w.    Individually polybagged.",One color imprint.,Silkscreen,,,,,Individually polybagged.,,,,,,,,,,,,,,,,,"BLACK, BLUE, GREEN, WHITE",Tools,"GEMINIPN_CL, TRIPNHI_CL, COVCLBD, HICKIES_CL, DSKMIR, FLSNRND_CL, RDTRPPR, TRADEBDG, MTYBRITE, USBFOLD, MINIDESK, MNLNTRL, CMPFRLGT, OVLTROPN, OVLTROPT, HYLANDPF, LIPBALM, SILBTLKC, ECMEDLNG, FOOTBL3, LGTUPLYD, EDISON_CL, MEDLNUSB, STRAWGLT, TRIBSPK, DENA",