Item# (SKU),Item Name,Catalog Page,Imprint Area,Product Description,Price Includes,Imprint Method 1,Imprint Method 2,Shipping Weight (lbs),Shipping Quantity,Shipping Dimensions (inch),Packaging,Additional Info,Pricing-Qty1,Pricing-Qty2,Pricing-Qty3,Pricing-Qty4,Pricing-Qty5,Pricing-Price1,Pricing-Price2,Pricing-Price3,Pricing-Price4,Pricing-Price5,Pricing-Code1,Pricing-Code2,Pricing-Code3,Pricing-Code4,Pricing-Code5,Available Colors,Product Categories,Related Products,Search Keywords10CONTAP_CL,10ft. Contractor Tape Measure - Closeout,,"1-1/8""h x 1-1/8""w","10ft. retractable metal tape measure with belt clip and locking mechanism.    Actual size is 2-3/4""h x 2-1/4""w.    Individually boxed.",One color imprint.,Silkscreen,,,,,Individually boxed.,This item requires an additional one day production time.,,,,,,,,,,,,,,,,YELLOW,Tools,"HATCHBAG, CHRO12PK, DRYITTWL, SNGLSCPM, TIREGE, TIRGEKYC, UNDPRKLT, ELRYKYLT, FLPNCHG, MTYBRITE, DESINTMB, WONMAT, GADGTLLT, FACILTP, TRA9LED, VISTSLNG, LGTUPLYD, RETRAKYR, CARASTRP, BARBRTLT, BAYCLTOT, BIGISTPN, CLRTOTBG, DRENBTL, FITNFAB, METPBKSK, SALN",11CAFECR,11oz. Cafe Mug,61,"2-3/4""h x 2-3/4""w each side or 2-3/4""h x 6-1/2""w wrap",Economical ceramic mug.    Comfortable C-handle.    Individually polybagged.    Egg crate packaging.,One color imprint.,Silkscreen,,29,36,12L x 16W x 11H,Egg crate packaging. Individually polybagged.,Must add  6.25 G  per case of 36 for damage-resistant boxes. All partial case quantities will be automatically rounded to the nearest case amount without notification.,144,288,576,1008,2016,2.59,2.49,2.35,2.09,1.99,C,C,C,C,C,"Red, Cobalt Blue, Black, Hunter Green",Drinkware,"6PKTPATH, 9TEDVPKL, MAGNACLP, CAMOKONE, CACHEPRO, PICNIC, BASEBL, EXMANPNC, CAMOFL, BEACHNIK, DRAWBKSK, CERENJR, BIKEBTLC, BCOKC, SILVHIGH, 6IN1, STAR, HNDWARM, IRWINEXE, BSKTBL, CLENFTBT, BEVRCDCM, SHOEBAG, INFUSER, BRANDCHG, SLKPEN, OXFRDJOT, CFLYER, BE","ceramic, c handle mug, 11oz mug, white mug"11CAFEMG,11oz. Cafe Mug,61,"2-3/4""h x 2-3/4""w each side or 2-3/4""h x 6-1/2""w wrap",Economical ceramic mug.    Comfortable C-handle.    Individually polybagged.    Egg crate packaging.,One color imprint.,Silkscreen,,32,36,13L x 19W x 15H,Egg crate packaging. Individually polybagged.,Must add  6.25 G  per case of 36 for damage-resistant boxes. All partial case quantities will be automatically rounded to the nearest case amount without notification.,144,288,576,1008,2016,1.99,1.89,1.75,1.69,1.55,C,C,C,C,C,WHITE,Drinkware,"APROFRNC_CL, APROCHAP_CL, BBLBAU_CL, 6PKBUDGT_CL, CARTATOT_CL, ACTDUFL_CL, CHIBGLAM_CL, HEROHT, 6PKBG_CL, 16VOY_CL, GRPBOLD, HOTSHTGL, FENDUFL_CL, 10CONTAP_CL, NEOCLONE, GETFITDF, STKPONKT, JAVAMUG_CL, BIKEBTLC, CAMOKLR, 11CAFECR, LAZERBTL, THMGOBTL, ACTS","c handle mug, 11oz mug, classic, mug, economical, ceramic, vote"12BISTRO,Bistro Mug,59,"1-1/2""h x 2""w each side  or  1-1/2""h x 6-1/2""w wrap",12oz. ceramic mug with matching ceramic spoon.    Individually polybagged.    Spoons packaged separately.    Egg crate packaging.,One color imprint.,Silkscreen,,31,36,19L x 15W x 13H,Egg crate packaging. Individually polybagged.,1. Must add  6.25 G  per case of 36 for damage-resistant boxes. All partial case quantities will be automatically rounded to the nearest case amount without notification.  2. No two mugs are exactly the same because they are hand painted. We consider this,144,288,576,720,1152,3.39,3.29,3.19,3.09,2.99,C,C,C,C,C,"BLACK/TURQUOISE, BLACK/LIME, BLACK/RED, WHITE/BLUE, WHITE/RED, BLACK/WHITE, REFLEX BLUE/WHITE, WHITE/WHITE",Drinkware,"APPLE, 12PKCAMO, 20INLET, GRPBOLD, NEOFLAT, SILISHOT, SODATRIT, TOGOTMB, UNOCCLR, SIPNSTYL, DESKBOX, GOLFTOWL, GSRVTQSR, MINIDESK, MTYBRITE, PNPALNBK, PNPXLNB, QUADCANV, VWINOPN, BEACHNIK, BBUY, BCOKC, BANDITBK, 6PKTPATH, 5TEDVPKL, ALOHAPN, 25CONTAP, ADVE","mug with spoon, 12oz mug, bistro, matching spoon"12GRPNGO,12oz. Grip N Go,30,"2-1/2""h x 3""w each side or 2-1/2""h x 7-1/2""w wrap.",BPA Free!    PolyPro cup with solid colored drink thru lid and black rubber bottom.    Double wall insulated.,One color imprint,Silkscreen,,12,36,23L x 12W x 13H,,"US Patent D675,524. Other patent pending.",72,144,288,576,1152,3.79,3.63,3.45,3.29,2.99,C,C,C,C,C,"BLACK, BLUE, RED, ORANGE, PINK, HUNTER GREEN",Drinkware,"PADPOD, PARSNYPN, CHRODLUX, CHROM6PK, DIXIJAR, DRAWBKSK, SILBRACD, COLKKLR, BREAKER, CAMOBKSK, CHIBGLAM, BASEBL, AUDIOEB, COPERCSE, BANDITBK, BERMDAEX, BDGBLANK, CALKBLK, PIGGYBNK, ATHENAPN, CACHEONY, CACHEPN, CACHONPR, CALIOPN, CALIOPRO, CARNVPRO, CARNVP","tangerinetango, poly pro cup, paper cup, lid, drink thru lid, double wall insulated, cup, solid color lid, colorful, bpa free, black rubber bottom, beverage"12ORBTMB,12oz. Orbit Tumbler,21,"2""h x 3""w one side  or  2""h x 8""w wrap",BPA Free!    Double wall insulated acrylic tumbler.    Lid included in color of choice.,One color imprint.,Silkscreen,,9,24,6L x 22W x 15H,,1. Non-microwavable.  2. For cold or hot beverages.  3. One side imprint recommended.  4. Specify tumbler color and lid color on PO.,72,144,288,576,1008,5.29,4.98,4.74,4.39,3.99,C,C,C,C,C,CLEAR,Drinkware,"MINIATH, MINWNDFL, SPRINTSS, LAZERBTL, ENDUTRIT, CARYTMB, PERFRBTL, SHAKITUP, WATMEDPC, SUNTOT, CRSCALJR, CLPSLNCH, CLRTOTBG, ZGZGBKSK, REEFBKSK, STADBLKT, WALLTOTE, CHRODLUX, INSHPTOT, CARRYCLR, SILBRACP, LUGSPTOR, CFLYER, MAGNAJMB, DIVOTFXR, MAGNACLP, G","orbit,  orbspecial, double wall insulated, bpa free, acrylic tumbler, solid color lid"12PKBG,12 Pack Cooler Bag,205,"3""h x 5""w","Holds 12 bottles or cans.    Back mesh pocket.    6""h x 8-1/2""w front zip pocket.    Strap adjusts to 44"".    Actual size is 11""h x 10""w x 6-1/4""d.",One color imprint.,Silkscreen,,30,40,17L x 23W x 29H,Bulk,,50,100,250,500,1000,8.89,8.49,8.19,7.79,7.49,C,C,C,C,C,"BLUE, GREEN, RED",Coolers,"16VOY_CL, 6PKBG_CL, CLPSLNCH, CLRTOTBG, CTYCLRKT, SILBRACD, COLKKLR, CARRYON, BASEBL, CLPCPHAN, AUDIOEB, BARTPEN, BNDYBRT, CALLCASH, COPERCSE, BERMDAEX, BDGBLANK, BMBONBK, CALKBLK, CALKTC, PIGGYBNK, ATHENAPN, BABELIPN, CACHEONY, CACHEPN, CACHONPR, CALIOPN","zippered, thick, zipper, strap, pocket, handle, adjustable, lunch, bottles, mesh, cooler, 12, zip"12PKCAMO,12 Pack Camo Cooler Bag,209,"3-1/2""h x 5""w","New camo pattern!    600D camouflage material with silver PEVA lining  and heat sealed.    38"" adjustable black webb strap and front slip pocket.    Actual size 11""h x 8""w x 6""d.",One color imprint.,Silkscreen,,28,50,16L x 24W x 15H,,Please note that this camo is different from our 2014 catalog. The camo pattern is lighter.,50,100,250,500,1000,8.99,8.59,8.29,7.89,7.59,C,C,C,C,C,CAMO,Coolers,"17OUTBK, 16FREFAC, ALCHCMBO, 16CORTMB, 6PKTPATH, 18HYFLAT, 16GRPNGO, 20FRSTBB, 20DWREV, 24REVOTL, 24REVNEO, 16CORMUG, 12GRPNGO, 20STD2GO, ARROW, 28BLEBTL, ALOHAPN, ACTSPBTL, 22GRPNGO, 16SATMUG, 16KARTMB, 20FLATFL, 16SATTMB, 27FLPFRE, 28TALNCL, 25CONTAP, A","peva, lunch, handle, 12, camo, cooler, lined, pocket, zip, zipper"14ECONMG,14oz. Economy Stainless Steel Mug,57,"2-1/2""h x 3""w each side or 2-1/2""h x 8""w wrap",BPA Free!    Double wall insulated.    Plastic liner.,One color imprint.,Silkscreen,,20,36,21L x 12W x 19H,,1. This item requires an additional one day production time.    2. Non-microwavable.,72,144,288,576,1152,4.59,4.45,4.19,3.99,3.79,C,C,C,C,C,"BLUE, STAINLESS",Drinkware,"MTYBRITE, MINISTKY, MINIATH, MINWNDFL, SPRINTSS, STYLITE, PERFRBTL, CLPSLNCH, CTYCLRKT, FLPNCHG, WATMEDPC, FLIPPORT, MEDIALNG, PNKYHY, SOLARPN, UNIUSB, CLRTOTBG, GLOBE, HEARTRE, ONGOSANT, FLOS2GO, BELMSTPN, CORDKPR, BEVRCDCM, BUBKEG, CLRBLKBK, COMMTOT, DR","automobile, bpa free, plastic liner, plastic, mug, gauge, stainless steel, double wall insultated, cup, approved"14FLATSN,14oz. Flat Snap Bottle,42,"2-1/2""h x 2-1/2""w one side",BPA Free!    Foldable bottle with snap closure and carabiner.    Push pull and tethered cap.    Easy to fold plastic for storage and travel.,One color imprint.,Silkscreen,,15,200,22L x 19W x 11H,,1. Volume and shape of bottle varies according to contents.  2. Not intended for hot beverages.  3. Carabiner not intended for climbing.,150,250,500,1000,2500,2.59,2.49,2.35,2.19,1.99,C,C,C,C,C,"RED, WHITE, ROYAL",Drinkware,"BARBRTLT, 2DRINKWP, 2DRINKEM, BOMBTSK, BAYCLTOT, CANDLELT, ARROW, CARASTRP, 20INLET, 12PKCAMO, 2HANSAN, APPLE, BARTPEN, CLASSTRAV, CARRYON, BABELIPN, CANUSAVE, BMBONBK, CALLCASH, BNDYBRT, AEROBKSK, ALBCOKC, 5TEDVPKL, ADVENBPK, 6PKTPATH, ARROWCLP, BELMSTPN","flat bottle, foldable, push pull lid, snap closure, tethered cap, easy to fold, drink, bpa free"14PATTMB,14oz. Patriot Tumbler,54,"2-1/4""h x 2-1/2""w each side  or  2-1/4""h x 7-1/2""w wrap",BPA Free!    Double wall insulated construction.    Stainless steel exterior and plastic inner liner.,One color imprint.,Silkscreen,,18,36,23L x 23W x 9H,,"1. This item requires an additional one day production time.  2. White, Metallic Silver or Metallic Gold imprints are recommended on darker colored tumblers.  3. Non-microwavable.",72,144,288,576,1152,4.79,4.59,4.29,4.09,3.89,C,C,C,C,C,"BLUE, RED, STAINLESS",Drinkware,"BIOCUP, DRAWSPRT, KLPNOTES, HANSPRAY, MEDILNGS, RIVET, FLIPBNDG, HLTHHND, LIPBALM, SUNSPYLB, TEKTRACK, TEMPRPCK, ELRYKYLT, FOURPWBK, HISTNTOT, JUPITPN, LYMBPOCK, METPBKSK, NIKISTPN, ORBINF, PONZMNBG, SELFCAM, SILICOME, TRIBSPK, ULADPTR, ULPOWBK, WILSNGLS,","plastic, colors, inner, insulated, beautiful, bpa free, outer, stainless, steel"15ORBTMG,15oz. Orbit Mug,22,"2""h x 2-1/2""w left side drinker view   2""h x 8-1/2""w wrap",BPA Free!    Double wall insulated acrylic mug.    Ergonomically designed handle.    Lid included in black.,One color imprint.,Silkscreen,,14,24,6L x 22W x 25H,,1. Non-microwavable.  2. For cold or hot beverages.  3. Only available on left handed drinker side or wrap imprint.,72,144,288,576,1008,6.29,5.99,5.69,5.39,4.99,C,C,C,C,C,CLEAR,Drinkware,"BIOCUP, ENDUTRIT, COLKONE, CAMOKONE, BABBUBKG, 6PKBG_CL, 16VOY_CL, BUBKEG, DIXIEMUG, INFUSER, MANHATTB, FLIPPORT, FLPNCHG, SILICOME, UNIUSB, VELOSTPN, COVCLBD, OXFRDJOT, RULRCLSI, 22IM_CL, JAVAMUG_CL, UNOMUG, PAPRNTOT, BIGLNGR, HYDRAPK, KCMSHBK, SALNTOTE,","stainless steel exterior, double wall, orbspecial,  orbspecial, plastic liner"16CORCLR,16oz. Cornado Tumbler,56,"1-3/4""h x 2-1/2""w  each side or 1-3/4""h x 7""w wrap",BPA Free!    Stainless steel outer wall with color plastic liner.    Stainless lid with slide lock.,One color imprint.,Silkscreen,,11,24,15L x 11W x 14H,,1. This item requires an additional one day production time.  2. Non-microwavable.  3. We strongly suggest requesting a sample of the neon colors prior to placing a PO. Neon colors do not accurately reproduce in catalog print.  4. Bold copy and large font,72,144,288,576,1008,5.09,4.89,4.59,4.29,3.99,C,C,C,C,C,"BLACK/BLUE, BLACK/RED, METALLIC BLUE/GREY, METALLIC GREEN/GREY, NEON BLUE, NEON GREEN, NEON PINK, NEON ORANGE",Drinkware,"16VOY_CL, SILICOME, SILIPOCK, RLCPCLKT, KLPNOTES, PNPALNBK, 6PKBG_CL, STRAWGLT, HEROHT, RLTRMBL, SVNUNOCP, MANHATTB, GSDYTPJR, PNPXLNB, TERRNBK, OXFRDJOT, LTDFLTBL, MULMDKPR, BEACHNIK, CAMOBKSK, XXLRECGY_CL, 16SUPRDM_CL, DESKBOX, SLIDACLP, CAPRSTPN, CLRNB","plastic liner, newneon, bpa free, slide lock lid, stainless steel exterior"16CORMUG,16oz. Cornado Mug,55,"1-3/4""h x 2-1/2""w each side  or  1-3/4""h x 7""w wrap",BPA Free!    Stainless steel exterior wall with colored plastic liner and handle.    Stainless lid with slide lock.,One color imprint.,Silkscreen,,12,24,16L x 12W x 15H,,1. This item requires an additional one day production time.  2. Non-microwavable.,72,144,288,576,1008,5.39,5.19,4.89,4.59,4.29,C,C,C,C,C,"SILVER/BLUE, SILVER/BLACK, SILVER/RED",Drinkware,"6PKBG, ALOHAPN, 12PKBG, 14ECONMG, 14PATTMB, 16CORCLR, 16CORTMB, 16GRPSS, 16KARTMB, 16SATMUG, THMGOBTL, 16JYMUG, 11CAFEMG, 12BISTRO, 12GRPNGO, 12ORBTMB, 14FLATSN, 15ORBTMG, 16FREDOM, 16FRE2GO, 16FREONE, 16FREFAC, 16GRPNGO, 16JAMOCA, 16ORBTMB, 16SATTMB, 17G","stainless steel exterior, slide lock lid, bpa free, plastic liner"16CORTMB,16oz. Cornado Tumbler,56,"1-3/4""h x 2-1/2""w  each side or 1-3/4""h x 7""w wrap",BPA Free!    Multi color imprint available.    Stainless steel outer wall with color plastic liner.    Stainless lid with slide lock.,One color imprint.,Silkscreen,,14,24,15L x 11W x 14H,,1. This item requires an additional one day production time.  2. Non-microwavable.  3. We strongly suggest requesting a sample of the neon colors prior to placing a PO. Neon colors do not accurately reproduce in catalog print.  4. Bold copy and large font,72,144,288,576,1008,4.99,4.79,4.49,4.19,3.89,C,C,C,C,C,"SILVER/BLUE, SILVER/RED, SILVER/BLACK, SILVER/GREEN, SILVER/ORANGE",Drinkware,"ZGZGBKSK, STADBLKT, WALLTOTE, CHRODLUX, INSHPTOT, USBAUTO, SILBRACP, LUGSPTOR, CFLYER, MAGNAJMB, DIVOTFXR, MAGNACLP, STDCUP20, SHOWTOTE, REGRTOT, PICNIC, WIPEOUT, LCURVEJR, LCURVEX, UNOMUG, FLOS2GO, BELMSTPN, CORDKPR, BEVRCDCM, CLRBLKBK, COMMTOT, DBLSQBPK","slide lock lid, plastic liner, stainless steel exterior, bpa free, tangerinetango"16FRE2GO,16oz. Free 2 Go Tumbler,17,"2-1/2""h x 2-1/2""w each side   or  2-1/2""h x 8""w wrap",BPA Free!    16oz. double wall PolyPro cup with snap  on lid and matching PolyPro straw.    SUPER VALUE!,One color imprint.,Silkscreen,,10,60,13L x 20W x 17H,,Non-microwavable,180,360,720,1440,2880,2.69,2.55,2.39,2.25,2.09,C,C,C,C,C,"Smoke, Blue, Red, Purple, Clear, Grass Green",Drinkware,"16FREDOM, 16FREFAC, 16FREONE, 22FREDOM, 28TALNCL, 30POLYCL, BIKEBTLC, 11CAFEMG, STDCUP20, 16ORBTMB, 20STD2GO, 20DWREV, 22GRPNGO, 18HYFLAT, 12BISTRO, 12GRPNGO, 12ORBTMB, 14ECONMG, 14FLATSN, 14PATTMB, 15ORBTMG, 16CORCLR, 16CORMUG, 16CORTMB, 16GRPNGO, 16JAMO","double wall, polypropylene cup, snap on lid, bpa free"16FREDOM,16oz. Freedom Tumbler,16,"3""h x 3-1/4""w each side or 3""h x 8-1/2""w wrap",BPA Free!    16oz. translucent acrylic double wall insulated cup  and matching PolyPro straw.    O-ring keeps straw in place.    Twist top lid.,One color imprint.,Silkscreen,,12,24,25L x 17W x 8H,,Non-microwavable,72,144,288,576,1008,3.89,3.69,3.49,3.19,2.99,C,C,C,C,C,"BLUE, GREEN, RED, SMOKE, CLEAR, MANDARIN, GRASS GREEN, AQUA, FUCHSIA, PURPLE",Drinkware,"16FREFAC_CL, DESINTMB, PRISTMB, APROFRNC_CL, APROCHAP_CL, BBLBAU_CL, 6PKBUDGT_CL, BASEBL, CARTATOT_CL, ACTDUFL_CL, CHIBGLAM_CL, 16FREONE_CL, MEDIASTA, SILBRACS, RBSUNGLS, GOTOTE, WEBTOTE, WALLTOTE, TRSTAMBG, WILDBKSK, LOLATMBL, FTNSDUFL, RETRVKL, RIBBON, ","summer, highqty, frespecial, high qty, bpa free, translucent acrylic, double wall insulated, o ring straw, mardigras, twist top lid"16FREFAC,16oz. Freedom Facet Tumbler,14,"3""h x 3-1/4""w each side  or  3""h x 8-1/2""w wrap",BPA Free!    16oz. double wall insulated acrylic tumbler.    Unique faceted design glimmers in light.    Matching color PolyPro straw.,One color imprint.,Silkscreen,,12,24,25L x 17W x 7H,,Non-microwavable,72,144,288,576,1008,5.09,4.89,4.59,4.19,3.79,C,C,C,C,C,"GRASS GREEN, RED, ROYAL, CLEAR, MANDARIN, FUCHSIA",Drinkware,"12PKBG, 12PKCAMO, ADVENBPK, APPLE, ARROW, ARROWCLP, ALOHAPN, ALCHCMBO, 6PKWAVE, 2HANSAN, BEVRCDCM, CHISHOP, CAMOBKSK, CHIBGLAM, SILIPINT, COLKKLR, DRAWBKSK, AUTOLNG, CACHEONY, CACHEPRO, CALIOPN, BDGBLANK, CALKBLK, BERMDAEX, AUDIOEB, BSKTBL, 6PKBG, 6IN1, B","twist top lid, vote, glimmers, high qty, pinktime, summer, faceted, bpa free, translucent acrylic, o ring straw, unique design, tangerinetango, frespecial, double wall insulated"16FREFAC_CL,16oz. Freedom Facet Tumbler - Closeout,,"3""h x 3-1/4""w each side  or  3""h x 8-1/2""w wrap",BPA Free!    16oz. double wall insulated acrylic tumbler.    Unique faceted design glimmers in light.    Matching color PolyPro straw.,One color imprint.,Silkscreen,,,,,,Non-microwavable,,,,,,,,,,,,,,,,SMOKE,Drinkware,"22FREDOM_CL, AUTORGZ_CL, BRANDCHG, ALBCOKC_CL, CORDKPR, CLRFILE, CLRBRITE_CL, CARATIZE, SICWINBG, STREABTL, SOLCHRG, SVNUNOCP, SPLSTOTE, SPIRSTPN, SPRINBTL, SILIPOCK, SILICOME, SPINPWBK, HABTSHP, TWISTPN, LNZSTPN, SCENRVBR, RLTRVMG, QUENBTL, 16FRE2GO, 16F",16FREONE,16oz. Freedom One Tumbler,17,"2-1/2""h x 2-1/2""w each side  or  2-1/2""h x 8""w wrap","BPA Free!    16oz. acrylic single wall cup with twist on lid and matching straw.    Cup, lid and o-ring straw packed separately in carton.    Stackable tumbler comes 60 per carton. Great freight savings.",One color imprint.,Silkscreen,,16,60,16L x 16W x 10H,,Non-microwavable,120,240,360,600,960,3.69,3.49,3.19,2.99,2.79,C,C,C,C,C,"BLUE, FUCHSIA, RED, SMOKE, AQUA, MANDARIN, GREEN, CLEAR",Drinkware,"PRISTMB, 16FREONE_CL, IGGINFSR, BARBRTLT, 2DRINKWP, 2DRINKEM, BOMBTSK, BAYCLTOT, CANDLELT, OASISBTL, 10CONTAP_CL, TROOPTMB, JETBKSK, KCMSHBK, RBSUNGLS, INFUSER, ORBINF, STRAWCQ_CL, APROFRNC_CL, NTROBKSK, ITABSLV, PNPXLNB, KICKSTND, WRPITUP, ZGZGBKSK, STRA","frespecial, single acrylic cup, twist on lid, bpa free"16FREONE_CL,16oz. Freedom One Tumbler - Closeout,,"2-1/2""h x 2-1/2""w each side  or  2-1/2""h x 8""w wrap","BPA Free!    16oz. acrylic single wall cup with twist on lid and matching straw.    Cup, lid and o-ring straw packed separately in carton.    Stackable tumbler comes 60 per carton. Great freight savings.",One color imprint.,Silkscreen,,,,,,Non-microwavable,,,,,,,,,,,,,,,,GRASS GREEN,Drinkware,"25QUEST_CL, ACTSPBTL, BIKEBTLC_CL, 22FREDOM_CL, AUTORGZ_CL, BRANDCHG, ALBCOKC_CL, CORDKPR, CLRFILE, CLRBRITE_CL, CARATIZE, SICWINBG, STREABTL, SOLCHRG, SVNUNOCP, SPLSTOTE, SPIRSTPN, SPRINBTL, SILIPOCK, SILICOME, SPINPWBK, HABTSHP, TWISTPN, LNZSTPN, SCENRV",16GRPNGO,16oz Grip N Go Grande,31,"1-3/8""h x 3-1/2""w each side or 1-3/8""h x 8-1/2""w wrap.",BPA Free!    16oz. PolyPro cup with diamond patterned rubber  grip with drink thru lid.    Matching colored rubber non-skid bottom.    Double wall insulated.,One color imprint.,Silkscreen,,16,36,23L x 12W x 15H,,"US Patents D,662,362 S, D,656,365, and  D675,524. Other patents pending.",72,144,288,576,1152,4.89,4.69,4.29,3.99,3.79,C,C,C,C,C,"BLACK, BLUE, RED, PURPLE, ORANGE, HUNTER GREEN",Drinkware,"6PKBG_CL, GLFPKATH, PNPXLNB, TERRNBK, OXFRDJOT, LTDFLTBL, MULMDKPR, RLTRMBL, SVNUNOCP, 16VOY_CL, 20INLET, ALCHCMBO, APPLE, 25CONTAP, ARROWCLP, 2HANSAN, BCOKC, KLCSTK, DIXIJAR, LAZERBTL, NEOFLAT, SILISHOT, UNOCCLR, CSTCK, CARLEYPN, QUASAR, SUPCHP, COMJOTPN","perfectlypink, paper cup, beverage, cup, colorful, prettyinpink, tangerinetango, bpa free, poly pro cup, solid color lid, drink thru lid, lid, black rubber bottom, double wall insulated"16GRPSS,16oz Grip N Go Stainless Tumbler,52,"1-1/2""h x 3-1/2""w each side  or  1-1/2""h x 8-1/2""w wrap",BPA Free!    Diamond patterned rubber grip with drink thru lid.    Matching colored rubber non-skid bottom.    Double wall insulated.    Made of 201 stainless and Polypropylene.,One color imprint.,Silkscreen,,18,36,23L x 12W x 15H,,"1. US Patents D,662,362 S, D,664,812 S. Other patents pending.  2. This item requires an additional one day production time.  3. Non-microwavable.",72,144,288,576,1152,7.49,7.29,6.99,6.39,5.99,C,C,C,C,C,"ROYAL BLUE, HUNTER GREEN, MAROON, BLACK",Drinkware,"SUPCHP, CLPSAFLS, SNGLSCPM, RTBADG, KLPNOTES, LUGSPTOR, CSTCK, SHOWTOTE, LONGTEES, STADBLKT, MTYBRITE, COMMTOT, CABANAPN, GOLFTOWL, FLIPBNDG, MEDIALNG, MEDILNGS, SILVHIGH, USBTWIST, GLIMMER, REGRTOT, UNOCCLR, GAMEBLKT, STYLITE, WILDBKSK, PLASFAN, GOLFTEE,","solid color lid, bpa free, plastic liner, stainless steel, lid, cup, beverage, colorful, drink thru lid, black rubber bottom, double wall insulated"16JAMOCA,16oz. Jamocha Mug,60,"1-3/4""h x 2""w each side or 1-3/4""h x 7-1/2""w wrap.",Ceramic mug with large handle that easily  accommodates 4 fingers.    Individually polybagged.    Egg crate packaging.,One color imprint.,Silkscreen,,35,36,21L x 17W x 15H,Egg crate packaging.  Individually polybagged.,1. Must add  6.25 G  per case of 36 for damage-resistant boxes. All partial case quantities will be automatically rounded to the nearest case amount without notification.  2. No two mugs are exactly the same because they are hand painted. We consider this,144,288,576,1008,2496,3.49,3.35,3.19,2.99,2.85,C,C,C,C,C,"BLACK, MIDNIGHT BLUE, LIME GREEN, WHITE, RED",Drinkware,"MINISTKY, MINIATH, MINWNDFL, BEVRCAD, BCKPKCLR, BANGSTX, FLOS2GO, AUDIOEB, CELLALNG, CORDKPR, COPERCSE, BANDITBK, BERMDAEX, BDGBLANK, CACHONPR, CACHEONY, CALIOPN, CALIOPRO, CARNVPN, BCOKC, BBUY, CLRBLKBK, DBLSQBPK, DRAWBKSK, DRAWSWNW, GOTOTE, HABTSHP, MIN","large ceramic mug, large handle"16JYMUG,16oz. Journey Mug,28,"2-1/2""h x 2-1/2""w each side or 2-1/2""h x 7-1/4""w wrap",BPA Free!    Double wall insulated.    Thumb slide lid.,One color imprint.,Silkscreen,,16,48,23L x 15W x 16H,,,144,288,576,1008,2496,3.19,3.09,2.99,2.89,2.79,C,C,C,C,C,"BLACK, BLUE, GREEN, RED, SILVER",Drinkware,"11CAFECR, 24ORBTMB, 24REVNEO, 34BUBTVL, ACTSPBTL, TOGOTMB, GRPGRAN, GSDAYTRP, LAZERBTL, CAMOKONE, CACHEPRO, PICNIC, BASEBL, EXMANPNC, CAMOFL, BEACHNIK, DRAWBKSK, CERENJR, BCOKC, SILVHIGH, 6IN1, STAR, HNDWARM, IRWINEXE, BSKTBL, BEVRCDCM, SHOEBAG, INFUSER, ","thumb slide lid, doulbe wall, bpa free"16KARTMB,16oz. Karma Tumbler,53,"1-1/4""h x 2-1/2""w each side or  1-1/4""h x 9""w wrap",BPA Free!    Double wall with stainless accent band.    Screw-on lid with thumb slide.,One color imprint.,Silkscreen,,14,30,23L x 20W x 9H,,1. This item requires an additional one day production time.  2. Non-microwavable.,90,150,300,600,1020,4.95,4.75,4.45,4.15,3.85,C,C,C,C,C,"STAINLESS W/BLUE, STAINLESS W/BLACK",Drinkware,"DRAWBKSK, JETBKSK, DBLTKDS, INFUSER, ATHENAPN, BARTPEN, NVLATBCS, MINIWIPE, LOLATMBL, CLPCPHAN, MNLNTRL, RBSUNGLS, CRDLSO, CTYSLKNB, CLRTOTBG, CLPSLNCH, CMPFRLGT, TRIBSPK, USBCOLTK, TIDYUPKC, HEARTRE, USBCHRM, USBMTLKR, CINBKPN, TEKTRACK, DRAWSPRT, SAVYHN","double wall, stainless, stainless accent band, bpa free, screw on lid, plastic, thumb slide lid, tumbler"16ORBTMB,16oz. Orbit Tumbler,22,"2-1//2""h x 3""w on one side  or  2-1/2""h x 8""w wrap",BPA Free!    Double wall insulated acrylic tumbler.    Lid included in color of choice.,One color imprint.,Silkscreen,,11,24,22L x 16W x 8H,,1. Non-microwavable.  2. For cold or hot beverages.  3. One side imprint recommended.  4. Specify tumbler color and lid color on PO.,72,144,288,576,1008,5.29,4.98,4.74,4.39,4.29,C,C,C,C,C,"SMOKE/BLACK, MAROON/CLEAR, RED/RED, BLUE/BLUE, PINK/CLEAR, ORANGE/CLEAR, AQUA/CLEAR, LIME/CLEAR, GREEN/CLEAR, PURPLE/CLEAR, BLUE/CLEAR, BLACK/CLEAR, RED/CLEAR",Drinkware,"AUTOLNG, HATCHBAG, TRVLBLKT, TWNTBCHG, SALNTOTE, JIVEHDPH, FLIPBNDG, MANSALON, TEKTRACK, TEMPRPCK, ELRYKYLT, JUPITPN, LYMBPOCK, METPBKSK, NIKISTPN, TRIBSPK, ULADPTR, ULPOWBK, HEROHT, DESINTMB, UNOMUG, SICWINBG, OASISBTL, CRKNTBK, FNTLBL, MGNTCLDP, SLIDACL","bpa free, acrylic tumbler,  orbspecial, double wall insulated, orbit, solid color lid"16SATMUG,16oz. Saturn Mug,55,"1-1/2""h x 2-1/2""w each side  or  1-1/2""h x 6-3/4""w wrap",BPA Free!    Stainless steel with plastic liner.    Drink-thru lid.    Black handle with molded grip.,One color imprint.,Silkscreen,,16,25,25L x 22W x 9H,,1. This item requires an additional one day production time.  2. Non-microwavable.,72,144,288,576,1152,6.29,5.99,5.59,5.09,4.89,C,C,C,C,C,STAINLESS,Drinkware,"16VOY_CL, 6PKBG_CL, CTYCLRKT, CARRYCLR, CAMOFL, BUSCLGTG, PONZMNBG, PNCFLBTL, MUTRDVTL, MASTRTL, MANHATTB, TPTPTMB, WVEBKPK, DBLSQBPK, BTLCAD, FLIPPORT, FITNFAB, FOURPWBK, FLPNCHG, HOTSHTGL, HANCCKPN, SVNUNOCP, GOTOTE, NYLFLYER, TRVBKPK, METROBK_CL, HANSP","unique, ringed, stainless, molded, plastic, handle, steel"16SATTMB,16oz. Saturn Tumbler,55,"1-1/2""h x 2-1/2""w each side  or  1-1/2""h x 8-1/2""w wrap",BPA Free!    Stainless steel with plastic liner.    Drink-thru lid.,One color imprint.,Silkscreen,,14,25,9L x 19W x 19H,,1. This item requires an additional one day production time.  2. Non-microwavable.,72,144,288,576,1152,5.99,5.69,5.29,4.79,4.59,C,C,C,C,C,STAINLESS,Drinkware,"SUNTOT, ZIPCOOL, GSRVTQSR, SILBTLKC, TCHKYCN, IWEARST, CFLYERT, INSHPTOT, SMOOTHMV, ENDUTRIT, TRVLBLKT, USBPEN, SFTYSTRB, LED17FLH, LNCHBDY, JAVAMUG, OVLTROPN, GFBXTMB, NEOCLONE, NEOCLTWO, CAMOKONE, COVCLBD, MAGNACLP, PERFRBTL, GRPBOLD, CLASSTRAV, GSDYTPJ","steel, stainless, plastic, ringed, bpa free, drink thru lid, unique"16SUPRDM_CL,16oz. Super Dome Tumbler - Closeout,,"2-1/2""h x 2-1/2""w each side   or  2-1/2""h x 8-1/2""w wrap",BPA Free!    16oz. double wall insulated with colored dome lid and matching curly-q straw.    Twist top with silicone plug to secure straw.,One color imprint.,Silkscreen,,,,,,Non-microwavable,,,,,,,,,,,,,,,,"RED, ROYAL BLUE",Drinkware,"AEROBKSK, CHIBGLAM_CL, ACTDUFL_CL, CARRYON, CHIBGLAM, 28TALNCL, 2HANSAN, 20TINTBB, 20FRSTBB, BIKEBTLC, BIOCUP, CFLYER, 16FRE2GO, 16JYMUG, 30POLYCL, 20STD2GO, 16FREFAC, 20NEONSS_CL, 20DWREV_CL, 10CONTAP_CL, 16FREFAC_CL, 17OUTBK_CL, 16VOY_CL, 16FREONE_CL, 2",16VOY_CL,16oz. Voyager Mug - Closeout,,"1-3/4""h x 2-1/4""w each side  or 1-3/4""h x 7""w wrap",Double wall insulated.     Screw on slider lid.,one color imprint.,Silkscreen,,,,,,"1. White, Metallic Silver, or Metallic Gold imprints are recommended on darker colored mugs.  2. Non-microwavable.   3. Hand wash only.  4. Shipped in case pack quantities of 36 only.",144,,,,,2.79,,,,,C,,,,,TRANS BLUE,Drinkware,"QUENBTL, ALCHMYPN, TOGOTMB, GRPGRAN, 22FREDOM_CL, AUTORGZ_CL, BRANDCHG, ALBCOKC_CL, CORDKPR, CLRFILE, CLRBRITE_CL, CARATIZE, SICWINBG, STREABTL, SOLCHRG, SVNUNOCP, SPLSTOTE, SPIRSTPN, SPRINBTL, SILIPOCK, SILICOME, SPINPWBK, HABTSHP, TWISTPN, LNZSTPN, SCEN",voyagerscrew on slider lid