Item# (SKU),Item Name,Catalog Page,Imprint Area,Product Description,Price Includes,Imprint Method 1,Imprint Method 2,Shipping Weight (lbs),Shipping Quantity,Shipping Dimensions (inch),Packaging,Additional Info,Pricing-Qty1,Pricing-Qty2,Pricing-Qty3,Pricing-Qty4,Pricing-Qty5,Pricing-Price1,Pricing-Price2,Pricing-Price3,Pricing-Price4,Pricing-Price5,Pricing-Code1,Pricing-Code2,Pricing-Code3,Pricing-Code4,Pricing-Code5,Available Colors,Product Categories,Related Products,Search KeywordsRIVET,Rivet LED Key Light,281,"1st Location: 7/16""h x 1-1/4""w   2nd Location  button side  : 7/16""h x 3/4""w","Translucent colors.    Super bright LED light.    Hold button in for light.    Batteries included.    Split key ring attached.    Actual size is 1""h x 2-1/2""w.    Individually polybagged.",One color imprint on one side.,Silkscreen,,23,600,9L x 12W x 15H,Bulk. Individually polybagged.,"Please indicate imprint location on PO. If no location is given, imprint location  1 is standard.",250,500,1000,1500,2500,1.3,1.2,1.05,0.99,0.95,C,C,C,C,C,"Blue, Green, Red, Smoke, Satin Silver",Tools,"BELMSTPN, INTOUCH, LNZSTPN, SMPLCKSC, CHIBGLAM, 14FLATSN, 16GRPNGO, BEACHNIK, USBAUTO, 16FRE2GO, SLENDSIP, 22FREDOM, 16FREFAC, ORBTRNL, BANDITBK, 9TEEPKL, STYLITE, FLSHSTK, CMPFRLGT, LGTNLOOK, PHZRFLSH, TRA9LED, FACILTP, CARRYON, HANDSAN, TAGGEL, HOWDYTZR","batteries, bright, led, key, modern, industrial, ring, trans"RIVIBAG,Riviera Cooler Bag,208,"4""h x 5-1/2""w","210D polyester, 5mm foam insulation, and silver PEVA lining.    Large front slip pocket with zip closure.    23"" handles.    Holds up to 15 lbs.    Actual size is 14""h x 18""w x 4""d.",One color imprint.,Silkscreen,,20,50,25L x 18W x 17H,,,50,100,250,500,1000,9.99,9.49,8.99,8.49,7.59,C,C,C,C,C,"BLACK, RED, BLUE",Coolers,"BOMBTSK, CALLCASH, BNDYBRT, FLIPPORT, FLPNCHG, JIVEHDPH, SILIPOCK, SOLCHRG, HEROHT, LED17FLH, WALLTOTE, JUBCLTOT, COLRNKT, ULADPTR, 16SATMUG, PENCIL, 16SATTMB, FNTLBL, MINIWRIT, SSLENDSP, CHIAMNTY_CL, CABANAPN, PIVTLKR_CL, MEDIALNG, MEDILNGS, NEONBB, BUSC","lining, pocket, peva, insulated, polyester, cooler, summer2014, handles, travel, sports"RIVIBAG_CL,Riviera Cooler Bag - Closeout,,"4""h x 5-1/2""w","210D polyester, 5mm foam insulation, and silver PEVA lining.    Large front slip pocket with zip closure.    23"" handles.    Holds up to 15 lbs.    Actual size is 14""h x 18""w x 4""d.",One color imprint.,Silkscreen,,,,,,,,,,,,,,,,,,,,,,KIWI,Coolers,"PLANEWLM_CL, TREMEBRT_CL, MARKITUP_CL, WHISTLE_CL, CLPSFSTB_CL, FENDUFL_CL, CHROM6PK, ULADPTR, DLXPICCL, CYCLONE, 16SATMUG, HNDWARM, PENCIL, NEOCLONE, 16SATTMB, FNTLBL, MINIWRIT, SSLENDSP, CONCORD, CABANAPN, PIVTLKR_CL, MEDIALNG, MEDILNGS, SLKMPNCL, NEONB","pocket, handles, peva, insulated, lining, closeout, cooler, polyester, sports, travel"RLCPCLBG,Roll and Clip Cooler Bag,204,"4""h x 7""w","210D roll top lunch bag with 3mm foam and silver PEVA lining.    Clip closure top.    Actual size is 12""h x 12-1/2""w and 4-1/2"" gusset.",One color imprint one side.,Silkscreen,,,,,,,50,100,250,500,1000,5.99,5.79,5.39,4.99,4.69,C,C,C,C,C,"BLUE, GREEN, RED",Coolers,"DRAWBKSK, HISTNTOT, WVEBKPK, PNCFLBTL, 24REVOTL, 24ORBTMB, BANGSTX, FLPNCHG, LPMEDPCH, JUBCLTOT, DBLSQBPK, DBLSQBPK_CL, FENDUFL_CL, RESRTOTE_CL, TALSBKSK_CL, DRAWSWNW, THRDNSTD_CL, EARMEDIA, CORDKPR, THMGOB25, BTLCAD, THMGOBTL, LEDLTBOK, 25QUEST_CL, STRAW","clip, roll, work, school, lining, peva, bags, lunch, summer2014, cooler"RLCPCLKT,Roll and Clip Cooler Kit,200,"Uno Can Cooler: 2""h x 2-1/2""w one side  Roll and Clip Cooler Bag: 4""h x 7""w  Collapsilunch: triangular: 2-1/4""h x 3-1/4""w x 4""l","Kit includes an Uno Can Cooler, a Roll and Clip Cooler Bag, and a Collapsilunch.    Each item color is to be noted on PO.    Additional colors are available.     Also available sold separately.",One color imprint on each item.,Silkscreen,,24,26,13L x 27W x 13H,,1. This item requires an additional 2 day production time.    2. Color Surge charges apply. Consult customer service rep for details.,50,100,250,500,1000,14.79,14.29,13.69,13.09,12.79,C,C,C,C,C,,"Drinkware, Coolers, Lifestyles","CRESTEX, HLTHHND, TRVSETBG_CL, SAVYHND, CRVGRPBL, NORDGRIP, SLKPEN, CRWNGRPT_CL, VELOSTPN, NEOCLTWO, CARDFOLI, SODATRIT, HATTRIKKT, STKPONKT, COMJOTPN, PLYCLATH, LCLRJR, LCURVEJR, MINIATH, MINMESH_CL, ZIPCOOL, 24AERIAL, TWICEBTL, USBCOLTK, CSTCKS, MINMANC","coolerkits14, summer2014"RLTRMBL,Bubba  24oz. Realtree Envy Tumbler,,"2-1/2""h x 3""w two sides or 2-1/2""h x 10""w wrap",Bubba iconic shape     BPA Free    Realtree  Blaze  accent    Realtree AP pattern    Fits in most cup holders.,One color imprint.,Silkscreen,,12,12,10L x 16W x 13H,,"Lifetime guarantee. Item can be shipped back to bubba , who will provide a new item that will be sent to the customer. Please note that the new item will not feature bubba  logo as on the original.",24,48,96,192,384,22.99,22.19,21.09,19.99,18.69,C,C,C,C,C,"PINK CAMO, BLACK CAMO",Drinkware,"24AERIAL, 24ORBTMB, ACTSPBTL, CRVGRPBL, ENDUTRIT, INFUSER, PERFRBTL, SLENDSIP, SMOOTHMV, SPRINTSS, SWNKYTMB, TWICEBTL, KPCLGKT, TRENTUM, TREKRTUM, FORCSTUM, SOLARPN, STYLPEN, BELMSTPN, VELOSTPN, NOVLEDFL, PHZRFLSH, TRA9LED, EXECBAND, EXERBODY, CARLEYCL, C",summer2014RLTRVMG,bubba  18oz. Realtree AP Travel Mug,,"2""h x 2-1/2""w one side only.  Right handed drinker view only  as shown .",18oz. DW travel mug with Realtree  Camo pattern.,One color imprint.,Silkscreen,,8,12,12L x 17W x 12H,,"Lifetime guarantee. Item can be shipped back to bubba , who will provide a new item that will be sent to the customer. Please note that the new item will not feature bubba  logo as on the original.",24,48,96,192,384,15.79,15.19,14.89,14.19,13.65,C,C,C,C,C,CAMO,Drinkware,"BABBUBKG, RLTRMBL, HEROHT, RLCPCLKT, SHKCLRKT, CTYCLRKT, DRYITTWL, FLIPPORT, FOURPWBK, DIXIEMUG, FLPNCHG, SPLSTOTE, UNOMUG, 16CORMUG, 16SATMUG, 30POLYCL, 16JYMUG, 16FRE2GO, CFLYER, 16FREFAC, 20NEONSS_CL, 16SUPRDM_CL, 20DWREV_CL, 10CONTAP_CL, 22FREDOM_CL, ",summer2014RTBADG,Retractable Badge Holder,163,"1"" Diameter","Approximately 30"" of retractable cord.    Snap closure for easy attachment.    Metal clip on back attaches to belt or lanyard.    Actual size is 1-1/4"" diameter.    Individually polybagged.",One color imprint.,Silkscreen,,14,500,9L x 23W x 17H,Individually polybagged.,,250,500,1000,2500,5000,1.17,1.11,1.06,0.98,0.89,C,C,C,C,C,"WHITE, TRANS BLUE",Workplace,"ITABSLV, PNPXLNB, KICKSTND, WRPITUP, ZGZGBKSK, GSDAYTRP, STRAWSTP, STRAWGLT, STCROPNW, STCROPNF, YORKPEN, CARLEYCL, CARLEYPN, YORKPNM, CLENFTBT, CRSCALEX, LCLREX, LCURVEX, CRSCALJR, LCLRJR, LCURVEJR, LTDFLTBL, NEOFLAT, SPRFNBTL, SUPCHP, CLPSAFLS, SNGLSCPM","belt, retractable, clip, metal, snap"RTRMDLNG,Retro Media Lounger,117,"Location 1: 1/2""h x 1-3/4""w  Location 2: 1-3/4""h x 1-3/4""w","Media lounger holds cell phone, MP3 player or other mobile device in an upright position for easy viewing.    Grip holds device in place.    Flexible mechanism for easy adjusting.    Actual size is 7-3/16""h x 2-5/16""w.    Individually polybagged.",One color imprint,Silkscreen,,28,250,8L x 22W x 16H,Individually polybagged.,"1. US Patent D,666,614. Other patents pending.  2. Location  1 is standard imprint.",150,250,500,1000,2500,2.45,2.35,2.25,2.05,1.89,C,C,C,C,C,"RED, GRASS GREEN, BLACK, SILVER, BLUE",Techno Trends,"CELLALNG, MULTTASK, BARTPEN, SPRACLMC, WEBTOTE, YOGAMAT, CITYLNH, SLENDSIP, STDCUP20, CFLYER, BIOCUP, WTRTBPCH, ACTSPBTL, TWICEBTL, SODATRIT, SILISHOT, LAZERBTL, TRSTAMBG, BRANDCHG, PADPOD, CALLCASH, SPRINTSS, USBAUTO, DBLWVSB, 20STD2GO, STCHSWKT, LENSCLN",RUBMSPD,"1/8"" Rubber Backed Mousepad",122,"6-1/2""h x 8""w","Cloth covered mousepad with 1/8""  thick rubber backing.    Actual size is 7-5/8""h x 9-1/2""w.",One color imprint,Silkscreen,,52,500,19L x 16W x 18H,,,150,250,500,1000,2500,1.99,1.92,1.87,1.82,1.79,C,C,C,C,C,"BLACK, BLUE, RED, WHITE",Workplace,"CHROM6PK, ULADPTR, NEOCLONE, CHIAMNTY_CL, PIVTLKR_CL, NEONBB, TAGGEL, SPRTYWAV, VIVIDPN, SALNTOTE, CHIBGLAM, PONZMNBG, 24REVOTL, MANSALON, TEMPRPCK, RIBBON_CL, SILBRACP, CLIPRND, COVCLBD, SNGLSCPM, APPLE, CARATIZE, 16CORCLR, DENALIPN, 34BUBTVL, SMOOTHMV, ",eqpRULRCLSI,Ruler Calculator,174,"3/4""h x 1-1/4""w",8 inch ruler.    English and Metric measurements.    Calculator is solar or battery powered.    Battery included.    Individually boxed.,One color imprint.,Silkscreen,,36,200,10L x 13W x 16H,Individually boxed.,,100,250,500,1000,2500,3.79,3.49,3.23,3.09,2.99,C,C,C,C,C,TRANS BLUE,Workplace,"OVLTROPN, 30POLYCL, SILBTLKC, 14PATTMB, 20STD2GO, 9TEDVPKL, 6PKTPATH, 16GRPSS, CLPSAFLS, SUNSCRGK, 18HYFLAT, ACTSPBTL, MINWNDFL, CLPCPHAN, TOGOTMB, HEARTRE, TREKRTUM, MEMOCUBE, SLIDMAG, FLEXRULE, KLPNOTES, EXECFLG, NTROBKSK, CARASTRP, SIPNSTYL, GLIMMER, M","battery, inch, calculator, solar"SALNTOTE,Salina Island Tote,193,"4""h x 10""w","Popular style tote bag in 600D polycanvas and woven & 39;jute like& 39; material.     Actual size is 15""h x 16""w x 4"" gusset.",One color imprint.,Silkscreen,,21,50,9L x 17W x 17H,,"Due to nature of & 39;jute like& 39; material, may have slight imperfections.",100,250,500,1000,2500,6.89,6.75,6.45,6.19,5.99,C,C,C,C,C,"Black, Royal, Lime, Pink",Bags,"CLAMFXLT, DIAMTMB, CLRTOTBG, DESMBPCK, TOGOTMB, TROOPTMB, MANHATTB, TURNTMB, NTROBKSK, FLEXFOLD_CL, FFORTCHG, PNKYHY, TWNTBCHG, BRANDCHG, RETROHS, LED17FLH, ULPOWBK, MINWNDFL, RULRCLSI, RETRFLSH, FLSHSTK, NOVLEDFL, PHZRFLSH, BABBUBKG, FLIPBNDG, TRSTRBG, L",totes2015SANDBUD_CL,Sandwich Buddy - Closeout,,"2-1/2""h x 4""w","Food container with 2 adjustable dividers.    Flip up lid with snap closure.    Actual size is 5-1/4""h x 7-1/8""w x 2-1/2""d.",One color imprint.,Silkscreen,,,,,,,,,,,,,,,,,,,,,,"REFLEX BLUE, FROST",Lifestyles,"RDTRPPR, TRADEBDG, FNTLBL, FOOTBL3, TOOLARND, MINIDESK, MNLNTRL, USBCHRM, OVLTROPN, OVLTROPT, HYLANDPF, LIPBALM, PROPITUP, FXHEADPH, SPHRLTOP_CL, MANI2GO_CL, FACILTP, MAZEPN, DREMJRNL_CL, PIGLETBK, USBTWIST, STPLRMV, GELEHIGH, REWNDHL, COZYCASE_CL, TEKTRA",SAVVYPN,Savvy Pen,77,"1/2""h x 1-1/2""w",Matte metallic barrel with matching clip and black accent color with silver trim and plunger.    Retractable mechanism.    Medium point black refill.,One color imprint,Silkscreen,,13,500,9L x 15W x 12H,,A silver imprint is recommended.  There is no set up charge on exact re-orders for writing instruments.,500,750,1000,2500,5000,0.68,0.68,0.68,0.68,0.68,C,C,C,C,C,"GUNMETAL, METALLIC REFLEX BLUE, METALLIC RED, METALLIC GREEN, METALLIC GOLD",Writing Instruments,"11CAFECR, 12BISTRO, CALIOPN, CARNVPN, STELNBK, STANRMVR, GFBXTMB, ORBTRNL, MESNGBRA, STRAWSTP, QUADCANV, ZIPCOOL, GAMEBLKT, PNPXLNB, ITABSLV, KICKSTND, PICNIC, ECMEDLNG, DBLVISN, CATLINEX, CRESTJR, CRSCALJR, LCLRJR, LCURVEJR, CERENJR, CRSCALEX, CRESTEX, L",SAVYHND,Savvy Hand Sanitizer,253,"1-3/4""h x 1""w","0.67 ounce hand sanitizer spray with curved easy finger release.    FDA approved.    Not refillable.    Actual size is 3-3/4""h x 1-3/4""w.    Individually polybagged.",One color imprint.,Silkscreen,,26,300,13L x 12W x 9H,Individually polybagged.,,250,500,1000,1500,2500,1.89,1.79,1.69,1.59,1.49,C,C,C,C,C,"WHITE, REFLEX BLUE, RED",Personal Care,"CLIPRND, ESQPEN, COVCLBD, SNGLSCPM, CLPSAFLS, GLOBE, STRSBL, STAR, FOOTBL3, CAMOKLR, 20STD2GO, RUBMSPD, 16SATMUG, 16GRPNGO, 18FLPFRE, 16CORMUG, BABBUBKG, 16JAMOCA, PARAPN, WRIONCLP_CL, FLDGOBG_CL, RLCPCLKT, QUADCLPN_CL, SUPCHP, CLPSFSTB_CL, SHKCLRKT, CTYC",hearthealthSAWYRSLV,Sawyer Tablet Sleeve,110,"Silk Screened: 5""h x 5""w   Debossed: 3-1/2""h x 5""w","Debossing available.    Leather-like padded sleeve for tablets, Kindles, etc.    Pull strap at top for easy access to device.    Loop closure.    Fits device up to 10""h x 7""w.    Actual size is 10-3/4""h x 8-1/2""w.",One color or debossed imprint.,Silkscreen,Deboss,18,40,11L x 18W x 16H,,1. There is an additional 5 day production time for debossing.  2. We suggest using a 12pt. Or larger block style font to ensure the best quality imprint.,80,160,320,640,1280,7.09,6.85,6.55,6.29,5.99,C,C,C,C,C,"DARK BROWN, RED, BLACK","Workplace, Techno Trends","ITABSLV, YORKPEN, GSRVTQSR, FORCSTUM, CTYSLKNB, TIRGEKYC, TRICRKSW_CL, SLIDMAG, CSTCK, GELEHIGH, REWNDHL, COZYCASE_CL, TEKTRACK, GOLFTOWL, BRZYLNGR, CFLYERT, FRQNTLGT, GTEES_CL, KPCLGKT, LONGTEES, GSHOPKATH, BIKEBTLC_CL, GAMESEAT_CL, GSDAYTRP, GSDYTPJR, T",SAXONPN,Saxon Pen,95,"Silk Screened: 5/8""h x 1-7/8""w  Laser Engraved: 1/4""h x 2""w","Metal pen with black rubber grip.    Chrome accents tip, clip, and plunger.    Retractable mechanism.    Medium point black refill.",One color or laser engraved imprint.,Silkscreen,Laser Engraved,,,,,1. Laser engraving not available on Silver.  2. 5 day production is required from time of art approval for   screen printing.  There is no set up charge on exact re-orders for writing instruments.,150,250,500,1000,2500,1.99,1.89,1.79,1.75,1.69,C,C,C,C,C,"SILVER, BLACK, BLUE",Writing Instruments,"USBPEN, GSSLEEK, SLKPEN, ATHENAPN, STYLPEN, TRIPNHI_CL, GOLFBALL, GOLFBALL_CL, GOLFTEE, DIVOTFXR, DREMJRNL_CL, MAZEPN, GSRVTQSR, FORCSTUM, TIRGEKYC, TRICRKSW_CL, CSTCK, COZYCASE_CL, GOLFTOWL, BRZYLNGR, CFLYERT, BIGLNGR, GTEES_CL, SUNSCRGK, MULMDATH, NITRO",SCENRVBR,Scent Removing Stainless Steel Bar,244,"1""h x 2""w","Stainless steel odor removing bar.    Removes odors from hands after handling most  seafood, garlic, onions and peppers.    Actual size approximately 3-1/2""w x 2-1/4""h.    Instruction card included.",One laser engraved imprint.,Laser Engraved,,45,200,15L x 22W x 13H,Packed in white box.,,100,200,400,800,1600,5.79,5.59,5.35,4.99,4.79,C,C,C,C,C,Stainless with Black base,Lifestyles,"OASISBTL, NIKISTPN, METPBKSK, TOOLARND, IWEARST, BUBKEG, UNOMUG, WVEBKPK, RLCPCLBG, DBLTKDS, TALSBKSK_CL, DRAWSWNW, DBLSTBPK, KCMSHBK, PEAKBKSK, THRDNSTD_CL, CRDLSO, WRPITUP, VALETKR, TIDYUPKC, CAPBTLOP, VWINOPN, TCHKYCN, INSHPTOT, PADPOD, CLRSTYKC, EARME",SELFCAM,iSelfie,123,"Option 1: 1""d or  Option 2: 3/8""h x 1-1/2""w","Camera shutter compatible with iPhone 3 or newer.     3.5 mm audio jack with 38"" cord not including jack.",One color imprint,Silkscreen,,,,,Packaged in white box.,"Please indicate imprint option on PO. If no option is given, option  1 is standard.",50,100,250,500,1000,11.59,11.29,10.89,10.39,9.99,C,C,C,C,C,"Blue, Pink, Lime",Techno Trends,"DRYITTWL, GRVGLWLT, HAPHRTMB, IGGINFSR, SCENRVBR, SPINPWBK, SOLCHRG, TWNTBCHG, 2DRINKWP, DESINTMB, FITNKIT, SILICOME, LNZSTPN, OASISBTL, NIKISTPN, METPBKSK, MUTRDVTL, MASTRTL, TOOLARND, BUBKEG, UNOMUG, WVEBKPK, RLCPCLBG, TALSBKSK_CL, DBLSTBPK, KCMSHBK, TH",SFTYSTRB,Safety Strobe Flashlight,302,"1st Location: 5/8""h x 1-1/2""w      2nd Location: 1-1/4"" diameter","Hook on light with 3 different light settings: strobe, solid and LED flashlight.    On/off button.    Individually polybagged.",One color imprint on one side.,Silkscreen,,7,100,12L x 13W x 7H,Individually polybagged.,Location  1 is standard imprint.  2. Highly recommend black imprint on second location.,150,250,500,1000,2500,2.99,2.85,2.69,2.59,2.49,C,C,C,C,C,"BLUE, LIME, RED, ORANGE",Tools,"BELLATMB, 34BUBTVL, CHIAMNTY_CL, CONCORD, TRICRKSW_CL, SLMPKTL_CL, 22FREDOM_CL, SLIDMAG, TETHGEL, YORKPEN, TRVSETBG_CL, NORDGRIP, GLFPKATH, CRWNGRPT_CL, RBSUNGLS, VELOSTPN, K2USBFAN, HATTRIKKT, STKPONKT, PNPALNBK, PIVTLKR_CL, PLYCLATH, MINMESH_CL, STRAWGL","button, colorful, flash, hook, led, light, safety, strobe, tangerinetango"SHAKITUP,18oz. Shake It Up Bottle,65,"2-1/2""h x 2-1/2""w each side","BPA Free!    Shaker bottle with filter screen for easy mixing.    Ounce and metric markers on side.    Removable bottom, screws on and off for easy storage of protein powders and other dry ingredients.    Mix together when ready to drink.",One color imprint.,Silkscreen,,13,24,18L x 16W x 13H,,1. Not intended for hot beverages.  2. Wrap imprint not available.  3. Will ship fully assembled.,72,144,288,576,1008,6.39,6.19,5.79,5.29,4.99,C,C,C,C,C,"BLUE, RED, BLACK",Drinkware,"CAPBTLOP, LETHSTPK_CL, SONICKL_CL, MICRPHKY, TCHKYCN, TEMPRPCK, VIBRNTLP, DRENBTL, STREABTL, DRAWBKSK, GLOBE, DRYITTWL, RBSUNGLS, ORBINF, IGGINFSR, TROOPTMB, USBPEN, CERENJR, SCENRVBR, BAYCLTOT, EVERYTOT, DESKBOX, MAGNIKL_CL, WHISTLE_CL, QUADCANV, COLKEVP","mixing, filter screen, shaker bottle, bpa free, storage"SHARKMCL,Shark Media Cleaner,137,"Option 1: 1/2""h x 1-3/4""w  or  Option 2: 1""h x 1""w","Plastic shark fin shape with a microfiber strip attached on bottom to clean media or phone screens.    Actual size is 2-1/8""h x 2-3/4""w.    Individually polybagged.",One color imprint.,Silkscreen,,,,,Individually polybagged.,Option  1 is standard imprint.,250,500,1000,2500,5000,1.23,1.17,1.09,1.05,0.99,C,C,C,C,C,"BLUE, BLACK, RED, WHITE, LIME",Techno Trends,"VIBRNTLP, LTDFLTBL, HOWDYTZR, BANDITBK, ELLSWORT, STDCUP20, OASISBTL, ORBINF, HATTRKBO, FLDGOBG_CL, TRVLBLKT, SUPERLT_CL, CATLINEX, CERENJR, TRINEXC_CL, TRINJR_CL, AUDIOEB, EARMEDIA, MEDLNUSB, MULTTASK, BELMSTPN, CORDKPR, WRPITUP, LPMEDPCH, STYLITE, SPRAC",SHKCLRKT,Shake It Cooler Kit,,"6 Pack Color Block Cooler: 3""h x 4""w  Shake It Up Salad Set: 2""h x 3""w one side  18oz. Shake It Up Bottle: 2-1/2""h x 2-1/2""w each side","Includes 6 Pack Color Block Cooler, Shake It Up Salad Set, and 18oz. Shake It Up Bottle.    Each item color is to be noted on PO.    Additional colors are available.     Also available sold separately.",One color imprint on each item.,Silkscreen,,14,14,9L x 23W x 17H,,1. This item requires an additional 2 day production time.    2. Color Surge charges apply. Consult customer service rep for details.,50,100,250,500,1000,11.99,11.29,10.69,10.39,9.99,C,C,C,C,C,,"Drinkware, Coolers","PRISTMB, RIVIBAG, HATCHBAG, PSHPWUSB, POWBANK, SCENRVBR, EVERYTOT, HISTNTOT, PAPRNTOT, BAYCLTOT, ORBINF, FITNKIT, GOLFBALL_CL, GOLFTEE, TTLPROV1, PIGLETBK, DREMJRNL_CL, ELLSWORT, STDCUP20, KLCSTK, OASISBTL, RTRMDLNG, KICKSTND, HATTRKBO, FLDGOBG_CL, TRVLBL","coolerkits14, summer2014"SHKSDST,Shake it Up Salad Set,65,"2""h x 3""w","Salad shaker combo includes salad container, fork, and salad dressing container all in one.    Holds 4 cups of salad and dressing container is 2 oz.  minor assembly required     Approximately 8""h x 4""w.",One color imprint,Silkscreen,,12,48,17L x 18W x 25H,,,96,192,384,768,1536,3.65,3.49,3.35,3.09,2.99,C,C,C,C,C,"FROST/REFLEX BLUE, FROST/GREEN","Drinkware, Lifestyles","VIVIDPN, SILVHIGH, BELMSTPN, BIGLNGR, CARDFOLI, FORCSTUM, MESNGBRA, TREKRTUM, WIDEMES, WIPEOUT, SHOWTOTE, REGRTOT, 16FREONE, 16ORBTMB, CLRFILE, 6PKBG, BTLCAD, INSHPTOT, ALCHCMBO, PIGGYBNK, 20DWREV, 24ORBTMB, SILBRACD, TAGGEL, HOWDYTZR, ONGOSANT, TRSTRBG, ","salad, salad dressing, fork, lunch, shaker"SHOEBAG,Golf Shoe Bag,230,"5""h x 4""w.",Large bag stores golf and other sports shoes.    Made with soft black jersey cloth with mesh vents.    Zip closure.    Stores flat.,One color imprint.,Silkscreen,,25,40,18L x 14W x 25H,,Requires an additional one day production time after art approval.,50,100,250,500,1000,8.59,8.19,7.79,7.19,6.59,C,C,C,C,C,BLACK,Lifestyles,"TCHKYCN, RIVIBAG, SNGLSCPM, PALERMEX, SAWYRSLV, WIDEMES, SAVVYPN, QUASAR, SMPLCKSC, MEMOCUBE, TTLPROV1, TRVLBLKT, STANRMVR, 16KARTMB, SLICKCLR, TEMPOPN, RTRMDLNG, ECMEDLNG, CRESTEX, LCURVEX, CAMOKLR, MAGNAJMB, MAGNACLP, SUNTOT, MAGNIKL_CL, WHISTLE_CL, RIV","cloth, golf, bag, mesh, soft, sports, zippered"SHOEKT,Shoe Shine Kit,220,"1-1/4"" Diameter either side","Kit contains silicone gel.    Screw top for secure closure.    Actual size is 2-5/16""diameter x 5/8""d.    Individually polybagged.",One color imprint on one side.,Silkscreen,,13,250,9L x 23W x 17H,Individually polybagged.,Imprint on lid is standard.,250,500,1000,1500,2500,0.89,0.85,0.79,0.75,0.69,C,C,C,C,C,"SOLID WHITE, TRANSLUCENT BLUE",Lifestyles,"INSHPTOT, ENDUTRIT, GSDAYTRP, MINICHI, USBPEN, SFTYSTRB, LED17FLH, PERFRBTL, CLENFTBT, FORCSTUM, CRESTEX, GRPGRAN, LNCHBDY, GFBXTMB, LCLREX, LCLRJR, CRSCALJR, CRSCALEX, KLCSTK, CSTCKS, SPRFNBTL, NEOCLTWO, CAMOKONE, 17GEOBTL, RETRAKYR, SPRTYWAV, CANOODPN, ","shine, secure, kit, silicone"SHOPTOTE_CL,Shopper Tote - Closeout,,"6""h x 7""w","80 gsm non-woven with front pocket and contrasting handle and gusset.    Actual size is 16""h x 18""w x 3"" gusset.",One color imprint.,Silkscreen,,,,,,,,,,,,,,,,,,,,,,"GREY/LIME, GREY/RED",Bags,"RIVET, MAGNIKL_CL, WHISTLE_CL, QUADCANV, COL3PKATH, COLKEVPK, JETBKSK, RIVALBKS, REEFBKSK, SPIRTBKS_CL, METROBK, WILDBKSK, NTROBKSK, ZGZGBKSK, METROBK_CL, TRVBKPK, SHKSDST, UNIUSB, SUNSHDSQ, YOGAMAT, CAPBTLOP, ENDUTRIT, VWINOPN, LETHSTPK_CL, FLOATER, LEDT",SHOTABST,Showcase Tablet Stand,126,"1""h x 2""w","Hand holder tablet stand convenient for use when carrying tablet.    Also used as a desk stand and features skid proof strip to keep item in place during use.    Actual size of hand holder is 4-3/4""h x 2""w.    Contact area for stand to tablet is 3""h x 2-3",One color imprint.,Silkscreen,,36,240,16L x 20W x 15H,,Not intended for use with mobile phones.,100,200,400,800,1200,4.19,3.99,3.69,3.49,3.29,C,C,C,C,C,"BLACK/BLACK, BLACK/SILVER",Techno Trends,"CMPFRLGT, VIVDCMBO, MGNTCLDP, CTYSLKNB, CRKNTBK, CANUSAVE, SLKMPNCL, RLCPCLKT, TOGOTMB, SILIPOCK, CHROM6PK, CHIBGLAM, 5TEDVPKL, TRVBKPK, DRAWBKSK, VALETKR, SUMMCMBO, COLKONE, VIVIDPN, SPECTRA, SHKCLRKT, CLENFTBT, STRAWGLT, USBCHRM, 20FLATFL, YORKPEN, YORK",fallessentialsSHOWTOTE,Show Tote,188,"7-1/2""h x 12""w","Hook and loop closure.    75 gsm non-woven.    Actual size is 14""h x 21""w x 5"" deep gusset and 25"" handles.",One color imprint.,Silkscreen,,21,200,21L x 16W x 16H,Bulk,,250,500,1000,2500,5000,2.15,2.09,1.99,1.85,1.59,C,C,C,C,C,"HUNTER GREEN, LIME, RED, ROYAL BLUE, CHARCOAL",Bags,"SPIRTBKS_CL, SHOPTOTE_CL, WILLTOTE_CL, XXLRECGY_CL, CARTATOT_CL, PONZMNBG, 10CONTAP_CL, HSEKYHLD, 25QUEST_CL, STRAWCQ_CL, SMOOTHMV, YOGCLKT, PLANEWLM_CL, EVERYSHP_CL, VISTSLNG, WILSNGLS, YOGABLK, NMDTRAD, TECHMSE_CL, PLAPKLAM_CL, EXERBODY, SILILID_CL, FLE","handles, storage, conventions, reusable, pocket, grocery, bags, carry, colors, stuffers, shopper, nonwoven, tab, tangerinetango, tote, trade, tradeshows, velcro"SIBLEYHI,Sibley Highlighter Pen,105,"1/4""h x 2""w",Silver plastic barrel twist action pen.    Highlighter at opposite end with colored cap indicating highlighter color.    Medium point black refill.    Individually polybagged.,One color imprint.,Silkscreen,,20,740,9L x 15W x 12H,Individually polybagged.,There is no set up charge on exact re-orders for writing instruments.,250,500,1000,2500,5000,1.29,1.22,1.17,1.09,0.99,C,C,C,C,C,"YELLOW, BLUE",Writing Instruments,"MULMDATH, MEETFOLO, MINWNDFL, MESURSPN, SOLSTPN, ESQPEN, DENALIPN, BLAKEHI, SILVHIGH, GELEHIGH, PROXPNHI, ORBTRNL, PARKYRG, MINISTKY, TEKTRACK, PNPDSGNB, HYLANDPF, LGTNLOOK, OVLTROPT, PALERMEX, TRADEBDG, SLIDACLP, SPSTKPD, STPLRMV, RULRCLSI, PHZRFLSH, PLA",SICWINBG,Sicily Wine Bag,193,"5""h x 2-1/2""w","600 D Polycanvas and woven paper bag with metal grommets and rope handles.    Great for carrying your favorite wine, specialty bottles of wines and vinegars or even event t-shirts!    Actual size is 13-4/5""h x 4"" w and 4"" gusset.    Due to the nature of t",One color imprint.,Silkscreen,,37,200,16L x 16W x 19H,,,150,250,500,1000,2500,3.99,3.79,3.49,3.19,2.99,C,C,C,C,C,"BLACK, NATURAL, HUNTER GREEN",Bags,"BANDITBK, HATTRKBO, BEACHNIK, HATTRIKKT, PNCFLBTL, 16GRPNGO, 18FLPFRE, 20DWREV, MEALTOGO, SILIPINT, 28BLEBTL, 2DRINKEM, 2DRINKWP, BARBRTLT, PAPRNTOT, CLRFILE, CLRFILE_CL, CLPCPHAN, BSKTBL, CLRBRITE_CL, CARATIZE, STREABTL, SOLCHRG, SVNUNOCP, SPIRSTPN, SPRI",totes2015SILBRACD,Debossed Silicone Bracelets,249,"3/8"" h x 3-1/2"" w","Imprint debossed into bracelet.    1/2"" wide.",Debossed imprint on one side.,Deboss,,,,,,"1. 7 day production time after art approval.     2. Less than 1st column quantity not available.      3. Adult size is 8"".     4. Ships FOB Texas.  5. Free spec sample product exceptions include all of the above stated in EQP exceptions. Spec sample decor",100,250,500,1000,2500,2.09,1.79,1.29,0.99,0.89,C,C,C,C,C,MISC,Lifestyles,"16FREFAC, BBUY, 5TEEPKL, CACHEPRO, 9TEDVPKL, 9TEEPKL, 6PKTPATH, 5TEDVPKL, BEVRCDCM, BUBKEG, 34BUBTVL, BUSCLGTG, SPECSBTL, FLSHSTK, STYLITE, MYSTLPN, CARYTMB, REEFBKSK, NOVLEDFL, ENDUTRIT, MEETFOLO, INTOUCH, 20STD2GO, HANSPRAY, IRWINEXE, LCLREX, SUNSHDSQ, ","produced, colors, silicone"SILBRACP,Silicone Bracelets,248,"1/4""h x  2-1/2""w","One color screened imprint on the bracelet s surface.    1/2"" wide.",One color imprint on one side.,Silkscreen,,,,,,"1. Requires a 5-6 week production time after art approval.  2. Less than 1st column quantity is not available.  3. Ships FOB China.  4. NO RUSH AVAILABLE.  5. If a pre production proof is required, an additional 2 weeks is needed for production.  6. Free ",100,250,500,1000,2500,1.79,1.25,0.89,0.79,0.69,C,C,C,C,C,MISC,Lifestyles,"CLIPRND, SUNSHDE, MINIWRIT, ORBTRNL, NTROBKSK, KLPNOTES, CINBKPN, MGNTCLDP, 20INLET, SLIDACLP, TIRGEKYC, USBAUTO, TIREGE, UNOCUP, AUTOLNG, SILBRACD, WIDEMES, MESNGBRA, SILBRACS, CFLYER, CFLYERT, LONGTEES, LUGSPTOR, IWEARST, 5TEEPKL, SMPLCKSC, NYLFLYER, BU","debossed, produced, bracelet s, silicone, bracelet s, colors"